Description,Total Amount,Profit,Profit Margin (%),Quantity
S/4 GROOVY CAT MAGNETS,151.92,75.96,50.0,142
BOTANICAL LILY GREETING CARD,151.62,75.81,50.0,361
MINI JIGSAW GO TO THE FAIR,151.5,75.75,50.0,387
JUNGLE POPSICLES ICE LOLLY HOLDERS,151.25,75.625,50.0,121
WHITE TISSUE REAM,151.05,75.525,50.0,19
RETRO LEAVES MAGNETIC NOTEPAD,150.79999999999998,75.39999999999999,50.0,104
FOLK ART METAL STAR T-LIGHT HOLDER,150.54,75.27,50.0,381
RAINBOW PEGS PHOTO CLIP STRING,150.18,75.09,50.0,264
BLUE KNITTED HEN ,150.15,75.075,50.0,91
WHITE 3 FRAME BIRDS AND TREE ,150.0,75.0,50.0,20
BLUE PAINTED KASHMIRI CHAIR,149.85000000000002,74.92500000000001,50.0,3
BLACK BAROQUE CARRIAGE CLOCK,149.67,74.835,50.0,17
KIDS CUTLERY SPACEBOY ,149.4,74.7,50.0,36
KIDS CUTLERY DOLLY GIRL ,149.4,74.7,50.0,36
BLOND DOLL DOORSTOP,149.25,74.625,50.0,115
PINK OVAL SHAPE TRINKET BOX,149.25,74.625,50.0,15
ROSE DU SUD WASHBAG ,148.75,74.375,50.0,25
CANDY SHOP  STICKER SHEET,148.75,74.375,50.0,175
METALIC LEAVES BAG CHARMS,148.32,74.16,50.0,60
NINJA RABBIT BLACK,148.29,74.145,50.0,116
PINK JEWELLED PHOTO FRAME,147.87,73.935,50.0,19
JARDIN ETCHED GLASS SMALL BELL JAR,147.85000000000002,73.92500000000001,50.0,43
CLASSICAL ROSE CANDLESTAND,147.35000000000002,73.67500000000001,50.0,187
ROUND WHITE CONFETTI IN TUBE,146.85,73.425,50.0,89
RETRO PLASTIC 70'S TRAY,146.55,73.275,50.0,343
POLYESTER FILLER PAD 45x30cm,146.45,73.225,50.0,101
MILK PAN PINK POLKADOT,146.25,73.125,50.0,39
YELLOW EASTER EGG HUNT START POST,146.25,73.125,50.0,75
CLEAR LOVE BIRD T-LIGHT HOLDER,146.21,73.105,50.0,38
SMALLFOLKART BAUBLE CHRISTMAS DEC,146.04,73.02,50.0,558
RED BOUDICCA LARGE BRACELET,145.95,72.975,50.0,21
STRIPES DESIGN TEDDY,145.35,72.675,50.0,57
FUSCHIA FLOWER PURSE WITH BEADS,145.17000000000002,72.58500000000001,50.0,159
PACK OF 12 CHRISTMAS FUN CARDS,144.55,72.275,50.0,49
BEACH HUT DESIGN BLACKBOARD,144.5,72.25,50.0,34
VINTAGE ROSE BEAD BRACELET RASPBERR,144.5,72.25,50.0,34
2 PICTURE BOOK EGGS EASTER DUCKS,143.75,71.875,50.0,115
ASSORTED COLOUR METAL CAT ,143.75,71.875,50.0,115
MOROCCAN BEATEN METAL MIRROR,143.3,71.65,50.0,14
SPACE BOY CHILDRENS CUP,143.3,71.65,50.0,130
SILVER STANDING GNOME   ,142.75,71.375,50.0,35
SILVER BRACELET W PASTEL FLOWER,142.5,71.25,50.0,19
MIRRORED WALL ART SPLODGES,142.5,71.25,50.0,98
PAISLEY PARK CARD,141.84,70.92,50.0,348
SET OF 12 ROSE BOTANICAL T-LIGHTS,141.60000000000002,70.80000000000001,50.0,48
MONEY BOX CONFECTIONERY DESIGN,141.5,70.75,50.0,137
BOTANICAL ROSE GREETING CARD,141.12,70.56,50.0,336
"DECOUPAGE,GREETING CARD,",141.12,70.56,50.0,336
FRENCH PAISLEY CUSHION COVER,141.10000000000002,70.55000000000001,50.0,170
ECONOMY LUGGAGE TAG,140.81,70.405,50.0,95
POPART RECT PENCIL SHARPENER ASST,140.52,70.26,50.0,1166
CERAMIC STRAWBERRY TRINKET TRAY,140.25,70.125,50.0,55
MOROCCAN BEATEN METAL DISH LARGE,140.25,70.125,50.0,11
RED DAISY POCKET BOOK ,140.18,70.09,50.0,164
METAL HERB GERDEN CONTAINER,139.68,69.84,50.0,24
BATHROOM SCALES RUBBER DUCKS,139.35,69.675,50.0,41
SILVER OVAL SHAPE TRINKET BOX,139.29999999999998,69.64999999999999,50.0,14
MOROCCAN BEATEN METAL DISH,139.29999999999998,69.64999999999999,50.0,14
BLUE DAISY MOBILE,138.76,69.38,50.0,172
LILAC DIAMANTE PEN IN GIFT BOX,138.72,69.36,50.0,26
VINTAGE BEAD NOTEBOOK,138.65,69.325,50.0,47
PURPLE ENAMEL FLOWER RING,138.65,69.325,50.0,47
MEDIUM PINK BUDDHA HEAD ,138.65,69.325,50.0,47
EASTER BUNNY WREATH,138.6,69.3,50.0,28
SET 4 PICNIC CUTLERY CHERRY ,138.45,69.225,50.0,71
FUNKY MONKEY GIFT BAG MEDIUM,138.18,69.09,50.0,329
PORCELAIN BUDAH INCENSE HOLDER,138.1,69.05,50.0,1501
QUEEN OF THE SKIES PASSPORT COVER ,137.88,68.94,50.0,68
BATHROOM HOOK,137.76,68.88,50.0,140
FIRST CLASS PASSPORT COVER ,137.74,68.87,50.0,66
CHALKBOARD KITCHEN ORGANISER,137.7,68.85,50.0,6
GOLD SCROLL GLASS T-LIGHT HOLDER,137.22,68.61,50.0,80
ABSTRACT CIRCLES POCKET BOOK,136.85,68.425,50.0,161
ASSORTED SANSKRIT MINI NOTEBOOK,136.25,68.125,50.0,109
CRYSTAL DIAMANTE EXPANDABLE RING,136.0,68.0,50.0,32
HEART T-LIGHT HOLDER,135.74,67.87,50.0,142
GREEN ENAMEL FLOWER RING,135.70000000000002,67.85000000000001,50.0,46
FRUIT TREE AND BIRDS WALL PLAQUE,135.15,67.575,50.0,17
S/6 SEW ON CROCHET FLOWERS,135.0,67.5,50.0,108
FLORAL PINK MONSTER,135.0,67.5,50.0,36
NUMBER TILE COTTAGE GARDEN 1,134.54999999999998,67.27499999999999,50.0,69
SKULLS DESIGN FLANNEL,134.54999999999998,67.27499999999999,50.0,161
POLYESTER FILLER PAD 30CMx30CM,133.75,66.875,50.0,107
DIAMANTE BOW BROOCH GREEN COLOUR,133.35,66.675,50.0,21
WHITE SQUARE TABLE CLOCK,132.99,66.495,50.0,94
COSY SLIPPER SHOES SMALL  RED ,132.75,66.375,50.0,45
BLUE CIRCLES DESIGN TEDDY,132.6,66.3,50.0,52
PINK/YELLOW FLOWERS HANDBAG,132.5,66.25,50.0,106
BLUE PUDDING SPOON,132.29999999999998,66.14999999999999,50.0,1010
SMALL KITCHEN FLOWER POTS PLAQUE,132.05,66.025,50.0,19
GREEN METAL BOX TOP SECRET,132.0,66.0,50.0,16
TUSCAN VILLA BIRD FEEDER,132.0,66.0,50.0,16
SMALL JEWELLERY STAND,132.0,66.0,50.0,16
"TUMBLER, NEW ENGLAND",131.94,65.97,50.0,138
RED KUKUI COCONUT SEED NECKLACE,131.8,65.9,50.0,112
GREEN MURANO TWIST BRACELET,131.75,65.875,50.0,31
NUMBER TILE COTTAGE GARDEN 2,130.65,65.325,50.0,67
SET OF 2 TEA TOWELS PING MICROWAVE,130.37,65.185,50.0,79
PAPERWEIGHT VINTAGE PAISLEY,130.26,65.13,50.0,134
S/4 BLACK MINI ROSE CANDLE IN BOWL,129.94,64.97,50.0,222
PINK HORSE SOCK PUPPET KIT,129.8,64.9,50.0,44
GOLD WINE GOBLET,129.56,64.78,50.0,164
GLASS CHALICE GREEN  SMALL ,129.51,64.755,50.0,147
MIRRORED WALL ART LADIES,129.15,64.575,50.0,161
SILVER APERITIF GLASS,128.4,64.2,50.0,276
THREE CANVAS LUGGAGE TAGS,128.26,64.13,50.0,66
75 GREEN PETIT FOUR CASES,128.1,64.05,50.0,305
SMALL WHITE/PINK ROSE ART FLOWER,127.57,63.785,50.0,113
GREEN WIRE STANDING CANDLE HOLDER,127.5,63.75,50.0,34
VINTAGE ROSE BEAD BRACELET BLACK,127.5,63.75,50.0,30
SPACE FROG,127.25,63.625,50.0,100
BEADED PEARL HEART WHITE LARGE,127.05,63.525,50.0,77
VINTAGE KEEPSAKE BOX TRAVELOGUE,127.0,63.5,50.0,20
SET 4 PICNIC CUTLERY FONDANT,126.75,63.375,50.0,65
GLASS SONGBIRD STORAGE JAR,126.7,63.35,50.0,11
FIRST CLASS LUGGAGE TAG ,126.69,63.345,50.0,105
CREAM SWEETHEART WALL CABINET,126.65,63.325,50.0,7
HANGING WOOD AND FELT HEART,126.0,63.0,50.0,300
FELT EGG COSY LADYBIRD ,125.67999999999999,62.839999999999996,50.0,256
LARGE JEWELLERY STAND,125.0,62.5,50.0,10
PURPLE ACRYLIC FACETED BANGLE,125.0,62.5,50.0,104
SILVER HOOP EARRINGS WITH FLOWER,124.95,62.475,50.0,21
SET OF 4 POLKADOT COASTERS,124.92,62.46,50.0,98
BEADED CRYSTAL HEART GREEN SMALL,124.11,62.055,50.0,101
PINK PILLAR CANDLE SILVER FLOCK,123.68,61.84,50.0,80
SMALL CAMPHOR WOOD FIELD  MUSHROOM,123.21,61.605,50.0,93
SET OF 3 MINI HANGING PORTRAITS,123.2,61.6,50.0,32
CRYSTAL STUD EARRINGS CLEAR DISPLAY,123.12,61.56,50.0,324
CANDY SPOT EGG WARMER RABBIT,122.94,61.47,50.0,502
LARGE PARLOUR FRAME,122.85,61.425,50.0,27
CHERRY BLOSSOM PASSPORT COVER,122.78,61.39,50.0,134
FRENCH ENAMEL UTENSIL HOLDER,122.75,61.375,50.0,37
BLUE ROUND COMPACT MIRROR,122.5,61.25,50.0,88
NINJA RABBIT PINK,122.45,61.225,50.0,101
BLACK MINI TAPE MEASURE ,121.3,60.65,50.0,158
ASSORTED CIRCULAR MOBILE,121.04999999999998,60.52499999999999,50.0,645
ZINC HEART LATTICE 2 WALL PLANTER,120.64999999999999,60.324999999999996,50.0,19
BEADED CRYSTAL HEART GREEN ON STICK,120.38,60.19,50.0,142
MIRROR MOSAIC CANDLE PLATE,120.07,60.035,50.0,151
DAISY FOLKART HEART DECORATION,120.0,60.0,50.0,96
GIFT BAG LARGE SPOT ,120.0,60.0,50.0,96
FLORAL SOFT CAR TOY,120.0,60.0,50.0,32
VINTAGE ZINC WATERING CAN,119.39999999999999,59.699999999999996,50.0,12
CANDY SPOT CUSHION COVER,119.36000000000001,59.68000000000001,50.0,40
YELLOW DRAGONFLY HELICOPTER,119.25,59.625,50.0,15
PINK OVAL JEWELLED MIRROR,119.0,59.5,50.0,20
SET OF 12 T-LIGHTS VINTAGE DOILEY,118.94999999999999,59.474999999999994,50.0,61
FOLDING MIRROR HOT PINK ,118.92000000000002,59.46000000000001,50.0,156
CITRUS GARLAND FELT FLOWERS ,117.0,58.5,50.0,60
MOCK LOBSTER FRIDGE MAGNET,116.61999999999999,58.309999999999995,50.0,266
RETRO PLASTIC DAISY TRAY,116.59,58.295,50.0,252
FRENCH STYLE STORAGE JAR JAM,116.58999999999999,58.294999999999995,50.0,323
BLACK SILOUETTE CANDLE PLATE,116.44999999999999,58.224999999999994,50.0,137
SUMMER FUN DESIGN SHOWER CAP,116.32999999999998,58.16499999999999,50.0,325
EIGHT PIECE DINOSAUR SET,116.25,58.125,50.0,93
"SMALL POP BOX,FUNKY MONKEY",116.25,58.125,50.0,93
RED   ACRYLIC FACETED BANGLE,115.9,57.95,50.0,94
NEW BAROQUE BLACK PHOTO ALBUM,115.55,57.775,50.0,26
LUNCH BAG VINTAGE DOILEY ,115.5,57.75,50.0,70
STARFISH SOAP DISH,115.25,57.625,50.0,59
GROOVY CACTUS INFLATABLE,114.41,57.205,50.0,291
BLUE FLY SWAT,114.21,57.105,50.0,135
WALL ART BICYCLE SAFTEY ,114.15,57.075,50.0,21
SILVER LARIAT 40CM,113.9,56.95,50.0,22
JADE DROP EARRINGS W FILIGREE,113.85000000000001,56.925000000000004,50.0,23
ICON PLACEMAT POP ART ELVIS,113.64,56.82,50.0,827
BEADED CRYSTAL HEART PINK ON STICK,113.09,56.545,50.0,115
PSYCHEDELIC WALL THERMOMETER,112.48,56.24,50.0,80
SCENTED CANDLE IN DIGITALIS TIN,111.30000000000001,55.650000000000006,50.0,53
BLUE CAT BISCUIT BARREL PINK HEART,111.14999999999999,55.574999999999996,50.0,57
NUMBER TILE VINTAGE FONT 3,110.28999999999999,55.144999999999996,50.0,83
PANTRY KITCHEN THERMOMETER ,110.0,55.0,50.0,88
LARGE CAMPHOR WOOD FIELD MUSHROOM ,109.80000000000001,54.900000000000006,50.0,24
LARGE TORTILLA DESIGN RED BOWL,109.8,54.9,50.0,64
RED PUDDING SPOON,109.74,54.87,50.0,837
VINTAGE KITCHEN PRINT PUDDINGS,109.65,54.825,50.0,43
PINK/BLUE STRING CURTAIN ,109.2,54.6,50.0,56
SNACK TRAY RED GINGHAM,109.2,54.6,50.0,56
NUMBER TILE COTTAGE GARDEN 9,109.2,54.6,50.0,56
NUMBER TILE COTTAGE GARDEN No,109.2,54.6,50.0,52
QUEEN OF SKIES LUGGAGE TAG,109.11,54.555,50.0,89
HEART T-LIGHT HOLDER ,108.75,54.375,50.0,75
5 STRAND GLASS NECKLACE CRYSTAL,107.94999999999999,53.974999999999994,50.0,17
PAPER LANTERN 6 POINT SNOW STAR,107.9,53.95,50.0,26
LAVENDER INCENSE 40 CONES IN TIN,107.45,53.725,50.0,109
HEN HOUSE W CHICK STANDING,107.39999999999999,53.699999999999996,50.0,270
NUMBER TILE COTTAGE GARDEN 4,107.25,53.625,50.0,55
HOUSE WRECKING METAL SIGN ,107.10000000000001,53.550000000000004,50.0,51
SMALL PARLOUR FRAME,106.98000000000002,53.49000000000001,50.0,42
MINI LADLE LOVE HEART PINK,106.98,53.49,50.0,243
BANK ACCOUNT  GREETING  CARD ,106.98,53.49,50.0,265
ZINC SWEETHEART SOAP DISH,106.9,53.45,50.0,60
FROSTED WHITE BASE ,106.44999999999999,53.224999999999994,50.0,229
WOODLAND LARGE BLUE FELT HEART,106.25,53.125,50.0,85
ASSORTED CHEESE FRIDGE MAGNETS,105.94999999999999,52.974999999999994,50.0,163
DAISY NOTEBOOK ,105.6,52.8,50.0,64
NUMBER TILE COTTAGE GARDEN 6,105.3,52.65,50.0,54
NUMBER TILE COTTAGE GARDEN 0 ,105.3,52.65,50.0,54
TEATIME PUSH DOWN RUBBER,105.28999999999999,52.644999999999996,50.0,467
FOLK FELT HANGING MULTICOL GARLAND,105.0,52.5,50.0,28
BOTANICAL LILY GIFT WRAP,105.0,52.5,50.0,250
PACKING CHARGE,105.0,52.5,50.0,14
12 PINK HEN+CHICKS IN BASKET,104.55,52.275,50.0,41
RED RETROSPOT WASHBAG,102.9,51.45,50.0,49
NUMBER TILE VINTAGE FONT 6 ,102.49,51.245,50.0,79
NUMBER TILE VINTAGE FONT 2,102.49,51.245,50.0,79
SET/3 RABBITS FLOWER SKIPPPING ROPE,102.0,51.0,50.0,120
LONG SILVER NECKLACE PASTEL FLOWER,102.0,51.0,50.0,8
MIRRORED WALL ART PHOTO FRAMES,102.0,51.0,50.0,24
PURPLE GEMSTONE NECKLACE 45CM,102.0,51.0,50.0,8
"ACRYLIC HANGING JEWEL,BLUE",101.84,50.92,50.0,268
CAROUSEL DESIGN WASHBAG,101.39999999999999,50.699999999999996,50.0,52
NUMBER TILE COTTAGE GARDEN 3 ,101.39999999999999,50.699999999999996,50.0,52
NUMBER TILE COTTAGE GARDEN 8,101.39999999999999,50.699999999999996,50.0,52
SET OF 4 CAROUSEL PLACEMATS ,101.06,50.53,50.0,70
MINI HIGHLIGHTER PENS,100.80000000000001,50.400000000000006,50.0,840
SMALL BLUE PROVENCAL CERAMIC BALL,100.64999999999999,50.324999999999996,50.0,61
NUMBER TILE VINTAGE FONT 4,100.53999999999999,50.269999999999996,50.0,78
"ACRYLIC JEWEL ICICLE, PINK",100.32000000000001,50.160000000000004,50.0,264
PACK/12 XMAS FUN CARD,100.30000000000001,50.150000000000006,50.0,34
BEADED CRYSTAL HEART BLUE SMALL,99.88,49.94,50.0,77
NUMBER TILE COTTAGE GARDEN 7,99.45,49.725,50.0,51
LAVENDER INCENSE IN TIN,99.28999999999999,49.644999999999996,50.0,172
TUSCAN VILLA DOVECOTE,99.0,49.5,50.0,12
TUSCAN VILLA FEEDING STATION,99.0,49.5,50.0,12
BUNDLE OF 3 RETRO EXERCISE BOOKS,99.0,49.5,50.0,60
BLACK CHUNKY BEAD BRACELET W STRAP,98.44999999999999,49.224999999999994,50.0,11
CHERRY BLOSSOM CANVAS ART PICTURE,97.95,48.975,50.0,41
PINK CANDYSTUFT ARTIFICIAL FLOWER,96.88999999999999,48.44499999999999,50.0,137
PINK HYDRANGEA ART FLOWER,96.60000000000001,48.300000000000004,50.0,46
PACK 3 BOXES CHRISTMAS PANETTONE,95.67,47.835,50.0,39
PURPLE GEMSTONE BRACELET,95.2,47.6,50.0,16
PACK 3 FIRE ENGINE/CAR PATCHES,95.0,47.5,50.0,76
NUMBER TILE VINTAGE FONT 5,94.69,47.345,50.0,75
YELLOW FLOWERS FELT HANDBAG KIT,94.5,47.25,50.0,45
WOVEN ROSE GARDEN CUSHION COVER ,94.05000000000001,47.025000000000006,50.0,19
PINK BERTIE GLASS BEAD BAG CHARM,93.89999999999999,46.949999999999996,50.0,109
HOME SWEEET HOME 3 PEG HANGER ,93.75,46.875,50.0,25
AMBER DIAMANTE EXPANDABLE RING,93.5,46.75,50.0,22
WHITE VINT ART DECO CRYSTAL NECKLAC,93.5,46.75,50.0,11
CHRISTMAS RETROSPOT HEART WOOD,93.5,46.75,50.0,110
BLACK GRAND BAROQUE PHOTO FRAME,93.0,46.5,50.0,48
NUMBER TILE VINTAGE FONT 7,92.74,46.37,50.0,74
POSY CANDY BAG,92.5,46.25,50.0,74
LARGE BLUE PROVENCAL CERAMIC BALL,92.4,46.2,50.0,44
BLUE PAISLEY NOTEBOOK,92.39999999999999,46.199999999999996,50.0,56
ASS FLORAL PRINT SPIRIT LEVEL ,92.08,46.04,50.0,96
PINK MARSHMALLOW SCARF KNITTING KIT,91.8,45.9,50.0,36
NUMBER TILE COTTAGE GARDEN 5,91.64999999999999,45.824999999999996,50.0,47
DOUBLE CERAMIC PARLOUR HOOK,91.30000000000001,45.650000000000006,50.0,22
IVORY SHELL HEART NECKLACE,90.67,45.335,50.0,19
JASMINE VOTIVE CANDLE,90.33999999999999,45.169999999999995,50.0,338
SILVER  CANDLEPOT JARDIN ,90.0,45.0,50.0,24
POLKADOT MUG PINK ,89.7,44.85,50.0,62
PINK BITTY LIGHT CHAIN,89.65,44.825,50.0,69
AMBER GLASS/SILVER BRACELET,89.5,44.75,50.0,10
WOODEN BOX ADVENT CALENDAR ,89.5,44.75,50.0,10
BLACK DIAMANTE EXPANDABLE RING,89.25,44.625,50.0,21
VINTAGE KITCHEN PRINT SEAFOOD,89.24999999999999,44.62499999999999,50.0,35
SILVER M.O.P ORBIT BRACELET,89.10000000000001,44.550000000000004,50.0,18
NUMBER TILE VINTAGE FONT 1,88.84,44.42,50.0,72
PAISLEY PATTERN  STICKERS,88.39999999999999,44.199999999999996,50.0,104
GREEN PEONY CUSHION COVER,88.35,44.175,50.0,19
MIRRORED WALL ART FOXY,88.2,44.1,50.0,15
"FLOWER GLASS GARLAND NECKL.36""BLACK",87.45,43.725,50.0,11
12 HANGING EGGS HAND PAINTED,87.36,43.68,50.0,42
BLACK+WHITE NECKLACE W TASSEL,87.35,43.675,50.0,13
OYSTER TRINKET BOX,87.12,43.56,50.0,48
SET/4 MODERN VINTAGE COTTON NAPKINS,86.75,43.375,50.0,77
GREEN FERN NOTEBOOK,85.8,42.9,50.0,52
PAINTED SEA SHELL METAL WINDCHIME,85.31,42.655,50.0,93
BLUE SWEETHEART BRACELET,85.0,42.5,50.0,20
BLUE MURANO TWIST BRACELET,85.0,42.5,50.0,20
SPACE CADET WHITE,84.88,42.44,50.0,65
FLAMES SUNGLASSES PINK LENSES,84.45,42.225,50.0,47
PINK STOCKING CHRISTMAS DECORATION,84.36,42.18,50.0,222
TURQUOISE CRYSTAL+GLASS BRACELET,84.15,42.075,50.0,17
MEDIUM PARLOUR FRAME ,84.1,42.05,50.0,22
WRAP FOLK ART,84.0,42.0,50.0,200
FOUR RABBIT EASTER DECORATIONS,83.75,41.875,50.0,67
BLUE KNITTED EGG COSY,83.46,41.73,50.0,150
PINK HEART OF GLASS BRACELET,83.3,41.65,50.0,14
ROSE DU SUD CUSHION COVER,82.55,41.275,50.0,13
PINK AND BLACK STRING CURTAIN,82.1,41.05,50.0,38
TEATIME GEL PENS ASST,82.08,41.04,50.0,504
IVY HEART WREATH,81.0,40.5,50.0,12
PEACH KNITTED HEN ,80.85000000000001,40.425000000000004,50.0,49
SET/6 POSIES PAPER PLATES,80.75,40.375,50.0,95
SILVER/M.O.P PENDANT ORBIT NECKLACE,80.75,40.375,50.0,14
WHITE GLASS CHUNKY CHARM BRACELET,80.55,40.275,50.0,9
BLUE GLASS CHUNKY CHARM BRACELET,80.55,40.275,50.0,9
SET 36 COLOUR PENCILS DOILEY,80.0,40.0,50.0,64
WHITE CHRYSANTHEMUMS ART FLOWER,79.8,39.9,50.0,38
ANT SILVER LIME GREEN BOUDICCA RING,79.65,39.825,50.0,27
SILVER/MOP ORBIT NECKLACE,79.6,39.8,50.0,8
GOLD M PEARL  ORBIT NECKLACE,79.6,39.8,50.0,8
GOLDIE LOOKING MIRROR,79.2,39.6,50.0,16
VINTAGE ZINC WATERING CAN SMALL,79.2,39.6,50.0,16
RED PEONY CUSHION COVER ,79.05,39.525,50.0,17
STRIPES DESIGN MONKEY DOLL,79.05,39.525,50.0,31
FLORAL BATHROOM SET,78.75,39.375,50.0,21
BEACH HUT KEY CABINET,78.75,39.375,50.0,21
BEADED CRYSTAL HEART BLUE ON STICK,78.71,39.355,50.0,73
CLASSIC CROME BICYCLE BELL ,77.4,38.7,50.0,60
GREEN HEART OF GLASS BRACELET,77.35,38.675,50.0,13
NUMBER TILE VINTAGE FONT 8,77.14,38.57,50.0,66
GOLD/M.O.P PENDANT ORBIT NECKLACE,76.5,38.25,50.0,9
TROPICAL LUGGAGE TAG,76.39,38.195,50.0,61
FROG CANDLE,76.25,38.125,50.0,61
DAISY HAIR BAND,75.9,37.95,50.0,46
MIRRORED WALL ART TABLE LAMP,75.73,37.865,50.0,67
VINTAGE ZINC PLANTER  ,75.66999999999999,37.834999999999994,50.0,23
CLEAR MILKSHAKE GLASS,75.60000000000001,37.800000000000004,50.0,36
VINTAGE ENGRAVED HEART,75.0,37.5,50.0,60
HILDA CANDY SPOT RABBIT,75.0,37.5,50.0,20
GREEN GEISHA GIRL ,75.0,37.5,50.0,20
BLUE GEISHA GIRL ,75.0,37.5,50.0,20
"RUSTIC WOODEN CABINET, GLASS DOORS",74.85,37.425,50.0,3
ALUMINIUM HEART,74.7,37.35,50.0,30
PAPER LANTERN 9 POINT HOLLY STAR 23,74.7,37.35,50.0,18
WOVEN BERRIES CUSHION COVER ,74.25,37.125,50.0,15
LILY BROOCH AMETHYST COLOUR,74.25,37.125,50.0,15
ROSE DU SUD CUSHION COVER ,74.25,37.125,50.0,15
BROWN KUKUI COCONUT SEED NECKLACE,74.0,37.0,50.0,74
MOUSEY LONG LEGS SOFT TOY,73.95,36.975,50.0,29
VINTAGE NOTEBOOK TRAVELOGUE,73.75,36.875,50.0,25
HANGING BAUBLE T-LIGHT HOLDER LARGE,73.75,36.875,50.0,25
VIP PASSPORT COVER ,73.5,36.75,50.0,35
DRAGONS BLOOD INCENSE,73.29,36.645,50.0,349
4 SKY BLUE DINNER CANDLES,72.5,36.25,50.0,58
SET OF 36 SPACEBOY PAPER DOILIES,72.5,36.25,50.0,50
POLYESTER FILLER PAD 65CMx65CM,72.25,36.125,50.0,17
SILVER M.O.P ORBIT DROP EARRINGS,72.25,36.125,50.0,17
SPOTTED WHITE NATURAL SEED NECKLACE,72.0,36.0,50.0,72
FLOWERS TILE HOOK,71.82,35.91,50.0,57
PINK KNITTED EGG COSY,71.75999999999999,35.879999999999995,50.0,140
AMBER CHUNKY GLASS+BEAD NECKLACE,71.69999999999999,35.849999999999994,50.0,6
AMBER CHUNKY BEAD BRACELET W STRAP,71.6,35.8,50.0,8
NECKLACE+BRACELET PINK BUTTERFLY,71.39999999999999,35.699999999999996,50.0,28
NUMBER TILE VINTAGE FONT 9 ,71.28999999999999,35.644999999999996,50.0,63
YELLOW POT PLANT CANDLE,71.05,35.525,50.0,23
CHARLIE AND LOLA CHARLOTTE BAG,70.95,35.475,50.0,43
CONGRATULATIONS BUNTING,70.85,35.425,50.0,13
STRIPY DESIGN SHOWER CAP,70.57,35.285,50.0,197
PINK ROSEBUD PEARL BRACELET,70.35,35.175,50.0,19
PINK SQUARE TABLE CLOCK,70.10000000000001,35.050000000000004,50.0,62
WRAP BAD HAIR DAY,70.0,35.0,50.0,700
BLUE WIRE SPIRAL CANDLE HOLDER,69.85,34.925,50.0,11
ROUND PURPLE CLOCK WITH SUCKER,69.73,34.865,50.0,367
GREEN MURANO TWIST NECKLACE,69.65,34.825,50.0,7
NUMBER TILE VINTAGE FONT 0,69.34,34.67,50.0,62
SET OF 12 MINI BUNNIES IN A BUCKET,69.30000000000001,34.650000000000006,50.0,33
WOVEN BUBBLE GUM CUSHION COVER,69.30000000000001,34.650000000000006,50.0,14
WOVEN CANDY CUSHION COVER ,69.3,34.65,50.0,14
ST TROPEZ NECKLACE,69.3,34.65,50.0,14
"GREETING CARD,SQUARE, DOUGHNUTS",68.84,34.42,50.0,160
4 BURGUNDY WINE DINNER CANDLES,68.75,34.375,50.0,55
EASTER BUNNY WITH BASKET ON BACK,68.25,34.125,50.0,105
ASSORTED FARMYARD ANIMALS IN BUCKET,68.06,34.03,50.0,86
CAKE STAND VICTORIAN FILIGREE LARGE,68.0,34.0,50.0,8
SILVER/NATURAL SHELL NECKLACE,68.0,34.0,50.0,8
BLACK VINT ART DEC CRYSTAL NECKLACE,68.0,34.0,50.0,8
"FOLK ART GREETING CARD,pack/12",67.85000000000001,33.925000000000004,50.0,23
ORIGAMI VANILLA INCENSE CONES,67.83,33.915,50.0,154
EASTER BUNNY HANGING GARLAND,67.5,33.75,50.0,54
LUSH GREENS RIBBONS,67.5,33.75,50.0,54
CRYSTAL PAIR HEART HAIR SLIDES,67.5,33.75,50.0,18
SMALL ZINC/GLASS CANDLEHOLDER,67.25,33.625,50.0,49
BLUE BLOSSOM HAIR CLIP,67.2,33.6,50.0,64
"ACRYLIC HANGING JEWEL,PINK",66.55,33.275,50.0,95
BEACH HUT MIRROR,66.39,33.195,50.0,49
WHITE  ROSEBUD PEARL BRACELET,65.7,32.85,50.0,28
PINK B'FLY C/COVER W BOBBLES,65.45,32.725,50.0,11
RASPBERRY ANT COPPER FLOWER NECKLAC,65.45,32.725,50.0,11
PURPLE BERTIE GLASS BEAD BAG CHARM,65.39999999999999,32.699999999999996,50.0,74
PACK/12 BLUE FOLKART CARDS,64.9,32.45,50.0,22
BISCUIT TIN VINTAGE LEAF,64.56,32.28,50.0,24
VINTAGE ENAMEL & CRYSTAL EARRINGS,64.35,32.175,50.0,13
"DECORATION HEN ON NEST, HANGING",64.35,32.175,50.0,39
CRYSTAL DIAMANTE STAR BROOCH,64.35,32.175,50.0,13
16 PC CUTLERY SET PANTRY DESIGN,63.8,31.9,50.0,4
SILVER LATTICE VANILLA CANDLE POT,63.75,31.875,50.0,17
FINE SILVER NECKLACE W PASTEL FLOWE,63.75,31.875,50.0,13
BLUE SQUARE COMPACT MIRROR,63.75,31.875,50.0,51
EAU DE NILE JEWELLED T-LIGHT HOLDER,63.75,31.875,50.0,75
MONEY BOX FIRST ADE DESIGN,63.75,31.875,50.0,51
PINK METAL SWINGING BUNNY,63.74999999999999,31.874999999999996,50.0,75
TURQUOISE BERTIE GLASS BEAD CHARM,63.3,31.65,50.0,73
"ACRYLIC JEWEL SNOWFLAKE, PINK",63.28,31.64,50.0,162
CHRISTMAS CRAFT HEART STOCKING ,63.0,31.5,50.0,30
METAL RABBIT LADDER EASTER ,62.9,31.45,50.0,74
SCOTTIES CHILDRENS APRON,62.7,31.35,50.0,38
MIDNIGHT BLUE GLASS/SILVER BRACELET,62.64999999999999,31.324999999999996,50.0,7
BLACK/WHITE GLASS/SILVER BRACELET,62.64999999999999,31.324999999999996,50.0,7
BLUE DISCO HANDBAG,62.629999999999995,31.314999999999998,50.0,31
PINK STRING CURTAIN WITH POLE,62.6,31.3,50.0,28
RED DAISY PAPER LAMPSHADE,62.5,31.25,50.0,50
SMALL HANGING GLASS+ZINC LANTERN,62.349999999999994,31.174999999999997,50.0,43
ORIGAMI SANDLEWOOD INCENSE+FLOWER,62.15,31.075,50.0,80
SET/6 POSIES PAPER CUPS,62.12,31.06,50.0,126
TURQUOISE GLASS TASSLE BAG CHARM ,61.95,30.975,50.0,21
ZINC HEART LATTICE CHARGER SMALL,61.95,30.975,50.0,21
A4 WALL TIDY BLUE OFFICE,61.86000000000001,30.930000000000003,50.0,114
FLOWERS HANDBAG blue and orange,61.25,30.625,50.0,49
"WALL ART ,PUDDINGS ",61.2,30.6,50.0,8
SET OF 72 GREEN PAPER DOILIES,60.9,30.45,50.0,42
SET OF 36 DOLLY GIRL PAPER DOILIES,60.9,30.45,50.0,42
HANGING RIDGE GLASS T-LIGHT HOLDER,60.84,30.42,50.0,36
ORIENTAL RED CUSHION COVER ,60.45,30.225,50.0,13
CUBIC MUG FLOCK BLUE ON BROWN,60.33,30.165,50.0,127
PIG MUG IN TWO COLOUR DESIGNS,60.04,30.02,50.0,128
ELVIS WALLHANGING / CURTAIN,60.0,30.0,50.0,48
PAIR BUTTERFLY HAIR CLIPS,60.0,30.0,50.0,16
"BATHROOM SCALES, TROPICAL BEACH",60.0,30.0,50.0,16
MIDNIGHT BLUE VINTAGE EARRINGS,60.0,30.0,50.0,16
"BREAD BIN, DINER STYLE, MINT",59.8,29.9,50.0,4
"BREAD BIN, DINER STYLE, IVORY",59.8,29.9,50.0,4
PINK MURANO TWIST NECKLACE,59.699999999999996,29.849999999999998,50.0,6
PINK PAISLEY CUSHION COVER ,59.5,29.75,50.0,10
WOVEN SUNSET CUSHION COVER ,59.400000000000006,29.700000000000003,50.0,12
RUSTIC STRAWBERRY JAMPOT SMALL,59.400000000000006,29.700000000000003,50.0,36
WAY OUT METAL SIGN ,59.400000000000006,29.700000000000003,50.0,36
PINK BUTTERFLY CUSHION COVER ,59.400000000000006,29.700000000000003,50.0,12
I LOVE LONDON WALL ART,59.400000000000006,29.700000000000003,50.0,12
AMBER DROP EARRINGS W LONG BEADS,59.00000000000001,29.500000000000004,50.0,20
ENGLISH ROSE METAL WASTE BIN,59.0,29.5,50.0,20
PINK & WHITE ROSEBUD RING,58.900000000000006,29.450000000000003,50.0,14
PARTY TIME DESIGN FLANNEL,58.9,29.45,50.0,72
"TUMBLER, BAROQUE",58.86,29.43,50.0,54
GARDEN PATH POCKET BOOK,58.65,29.325,50.0,69
CLEAR ACRYLIC FACETED BANGLE,58.6,29.3,50.0,40
CD WALL TIDY RED FLOWERS,58.56,29.28,50.0,160
SET OF 36 PANTRY PAPER DOILIES,58.019999999999996,29.009999999999998,50.0,39
SMOKEY GREY COLOUR GLASS,57.99999999999999,28.999999999999996,50.0,200
BLACK ORANGE SQUEEZER,57.96,28.98,50.0,138
TOP SECRET PEN SET,57.5,28.75,50.0,46
RETRO PINK BALL ASHTRAY ,57.5,28.75,50.0,46
SET 4 NURSERY DES ROUND BOXES,57.25,28.625,50.0,55
CUBIC MUG FLOCK PINK ON BROWN,57.18,28.59,50.0,130
PAIR OF ENAMEL BUTTERFLY HAIRCLIP,56.95,28.475,50.0,17
TEATIME PEN CASE & PENS,56.949999999999996,28.474999999999998,50.0,67
PINK/PURPLE CIRCLE CURTAIN,56.52,28.26,50.0,52
BLUE TABLE RUN FLOWER,56.25,28.125,50.0,45
BLUE TRAVEL FIRST AID KIT,56.1,28.05,50.0,34
SET OF 3 CONEY ISLAND OVAL BOXES,55.95,27.975,50.0,12
"LETTER ""A"" BLING KEY RING",55.71,27.855,50.0,63
CLASSICAL ROSE TABLE LAMP,55.7,27.85,50.0,6
"FLOWER GLASS GARLD NECKL36""AMETHYST",55.650000000000006,27.825000000000003,50.0,7
RECIPE BOX WITH METAL HEART,55.65,27.825,50.0,7
AMETHYST DIAMANTE EXPANDABLE RING,55.25,27.625,50.0,13
ROSE DU SUD DRAWSTRING BAG,55.25,27.625,50.0,13
SWEET PUDDING STICKER SHEET,55.24999999999999,27.624999999999996,50.0,65
BLACK SMALL GLASS CAKE STAND,54.99,27.495,50.0,61
COLUMBIAN CUBE CANDLE,54.599999999999994,27.299999999999997,50.0,28
WOVEN FROST CUSHION COVER,54.45,27.225,50.0,11
LILY BROOCH OLIVE COLOUR,54.45,27.225,50.0,11
CHRYSANTHEMUM POCKET BOOK ,54.4,27.2,50.0,64
"RETRO ""TEA FOR ONE"" ",54.3,27.15,50.0,14
GOLD FABRIC MIRROR,54.21,27.105,50.0,139
BLACK CHERRY LIGHTS,54.0,27.0,50.0,8
WHITE VINTAGE CRYSTAL BRACELET,54.0,27.0,50.0,8
BLUE TILED TRAY,54.0,27.0,50.0,8
SPACEBOY MINI RUCKSACK,53.95,26.975,50.0,13
WAKE UP COCKEREL TILE HOOK,53.85,26.925,50.0,46
ZINC HEART LATTICE TRAY OVAL ,53.550000000000004,26.775000000000002,50.0,9
HEART BUTTONS JEWELLERY BOX,53.550000000000004,26.775000000000002,50.0,7
GREEN FERN POCKET BOOK,53.55,26.775,50.0,63
BLUE ROSE PATCH PURSE PINK BUTTERFL,52.8,26.4,50.0,32
FOLK ART METAL HEART T-LIGHT HOLDER,52.760000000000005,26.380000000000003,50.0,145
HELLO SAILOR BATHROOM SET,52.5,26.25,50.0,14
FIRE POLISHED GLASS BRACELET GREEN,52.5,26.25,50.0,14
CREAM CLIMBING HYDRANGA ART FLOWER,52.5,26.25,50.0,30
BLUE CLIMBING HYDRANGA ART FLOWER,52.5,26.25,50.0,38
DIAMANTE NECKLACE PURPLE,52.5,26.25,50.0,7
DOORKNOB CERAMIC IVORY,52.2,26.1,50.0,36
RETO LEAVES MAGNETIC SHOPPING LIST,52.199999999999996,26.099999999999998,50.0,36
ORIGAMI OPIUM INCENSE/CANDLE SET ,52.05,26.025,50.0,59
VINTAGE BEAD COSMETIC BAG ,51.82,25.91,50.0,16
FRENCH CHATEAU SMALL FRUITBOWL,51.599999999999994,25.799999999999997,50.0,24
RETRO BROWN BALL ASHTRAY ,51.25,25.625,50.0,41
SPACE CADET BLACK,51.21,25.605,50.0,40
SILVER LARIAT BLACK STONE EARRINGS,51.0,25.5,50.0,12
BLACK GEMSTONE NECKLACE 45CM,51.0,25.5,50.0,4
NECKLACE+BRACELET SET BLUE HIBISCUS,50.99999999999999,25.499999999999996,50.0,20
TEATIME FUNKY FLOWER BACKPACK FOR 2,50.849999999999994,25.424999999999997,50.0,3
VINTAGE PHOTO ALBUM PARIS DAYS,50.8,25.4,50.0,8
