Description,Total Amount,Profit,Profit Margin (%),Quantity
CHERRY BLOSSOM DECORATIVE FLASK,678.18,339.09,50.0,182
FRENCH BLUE METAL DOOR SIGN 0,678.15,339.075,50.0,543
FELTCRAFT HAIRBAND PINK AND BLUE,676.5999999999999,338.29999999999995,50.0,796
SCOTTIE DOGS BABY BIB,676.39,338.195,50.0,1663
GARDENIA 1 WICK MORRIS BOXED CANDLE,676.03,338.015,50.0,211
KENSINGTON COFFEE SET,675.75,337.875,50.0,53
BOHEMIAN COLLAGE STATIONERY SET,675.53,337.765,50.0,471
KIDS RAIN MAC PINK,675.13,337.565,50.0,799
BRIGHT BLUES RIBBONS ,673.75,336.875,50.0,539
LOVE GARLAND PAINTED ZINC ,672.65,336.325,50.0,405
CINAMMON SET OF 9 T-LIGHTS,672.06,336.03,50.0,798
CHRISTMAS TREE HANGING SILVER ,671.77,335.885,50.0,747
UNION JACK FLAG LUGGAGE TAG,670.46,335.23,50.0,537
S/4 IVORY MINI ROSE CANDLE IN BOWL,669.91,334.955,50.0,491
DRAWER KNOB VINTAGE GLASS BALL,669.61,334.805,50.0,317
MULTICOLOUR HONEYCOMB FAN,669.12,334.56,50.0,1142
RED RETROSPOT TAPE,668.94,334.47,50.0,1458
VINTAGE BEAD PINK EVENING BAG,668.88,334.44,50.0,513
DOVE DECORATION PAINTED ZINC ,668.09,334.045,50.0,2283
PAPER BUNTING PAISLEY PARK,667.6,333.8,50.0,248
SMALL SILVER TRELLIS CANDLEPOT,666.7,333.35,50.0,226
EGG CUP HENRIETTA HEN CREAM ,664.52,332.26,50.0,580
BLOSSOM IMAGES GIFT WRAP SET,663.6,331.8,50.0,751
CHILDS GARDEN BRUSH BLUE,663.3000000000001,331.65000000000003,50.0,333
LARGE BONNE JAM JAR  T-LIGHT HOLDER,662.0600000000001,331.03000000000003,50.0,254
WRAP FLOWER SHOP  ,661.5,330.75,50.0,1575
SALLE DE BAIN HOOK,660.0699999999999,330.03499999999997,50.0,503
TRIPLE WIRE HOOK IVORY HEART,658.54,329.27,50.0,160
PAPER LANTERN 7 POINT SNOW STAR,658.35,329.175,50.0,99
VINTAGE RED MUG,657.62,328.81,50.0,688
PACK OF 6 SMALL FRUIT STRAWS,657.6,328.8,50.0,1648
SILK PURSE BABUSHKA RED,657.5000000000001,328.75000000000006,50.0,202
WHITE CHRISTMAS GARLAND STARS TREES,656.7,328.35,50.0,178
FAIRY CAKES NOTEBOOK A7 SIZE,655.34,327.67,50.0,1684
HEARTS  STICKERS,655.0,327.5,50.0,766
EASTER DECORATION EGG BUNNY ,654.7,327.35,50.0,828
CINAMMON & ORANGE WREATH,654.55,327.275,50.0,101
PEARLISED IVORY HEART LARGE ,651.15,325.575,50.0,415
ASSORTED EASTER DECORATIONS  BELLS,650.28,325.14,50.0,564
JAZZ HEARTS ADDRESS BOOK,648.69,324.345,50.0,3057
EASTER TREE YELLOW BIRDS,648.5500000000001,324.27500000000003,50.0,109
CERAMIC PLATE STRAWBERRY DESIGN,648.18,324.09,50.0,578
T-LIGHT HOLDER HANGING LACE,647.51,323.755,50.0,765
BANQUET BIRTHDAY  CARD  ,647.28,323.64,50.0,1572
DECORATIVE CATS BATHROOM BOTTLE,647.03,323.515,50.0,835
CARD CAT AND TREE ,646.5600000000001,323.28000000000003,50.0,1560
BIRD DECORATION RED RETROSPOT,646.0,323.0,50.0,760
BIRDHOUSE DECORATION MAGIC GARDEN,645.44,322.72,50.0,520
WASH BAG VINTAGE ROSE PAISLEY,645.15,322.575,50.0,253
PHOTO FRAME LINEN AND LACE SMALL,644.8000000000001,322.40000000000003,50.0,310
WALL ART HORSE & PONY ,644.6700000000001,322.33500000000004,50.0,209
NAMASTE SWAGAT INCENSE,643.14,321.57,50.0,2427
RED POLKADOT COFFEE  MUG,642.75,321.375,50.0,1499
RUSTIC STRAWBERRY JAM POT SMALL,642.0,321.0,50.0,408
BLOSSOM  IMAGES NOTEBOOK SET,640.5,320.25,50.0,498
HI TEC ALPINE HAND WARMER,639.36,319.68,50.0,732
LARGE WHITE/PINK ROSE ART FLOWER,639.36,319.68,50.0,360
MEASURING TAPE BABUSHKA RED,639.0,319.5,50.0,228
"BUNTING , SPOTTY ",634.7,317.35,50.0,146
CARD PARTY GAMES ,633.78,316.89,50.0,1581
S/12 VANILLA  BOTANICAL T-LIGHTS,632.7500000000001,316.37500000000006,50.0,221
CANDY HEART HANGING DECORATION,631.71,315.855,50.0,1265
MIRROR MOSAIC VOTIVE HOLDER,631.62,315.81,50.0,837
MAGIC DRAWING SLATE BUNNIES ,631.44,315.72,50.0,1716
POLKADOT RAIN HAT ,631.15,315.575,50.0,1589
PACK OF 12 PAISLEY PARK TISSUES ,630.63,315.315,50.0,1617
FENG SHUI PILLAR CANDLE,630.23,315.115,50.0,3317
SMALL APOTHECARY MEASURING JAR ,629.05,314.525,50.0,81
SET/6 FROG PRINCE T-LIGHT CANDLES,628.47,314.235,50.0,434
JARDIN ETCHED GLASS FRUITBOWL,627.45,313.725,50.0,123
OVAL  MINI PORTRAIT FRAME,627.4499999999999,313.72499999999997,50.0,323
MR ROBOT SOFT TOY,626.45,313.225,50.0,211
IVORY ENCHANTED FOREST PLACEMAT,626.1,313.05,50.0,394
TRAVEL CARD WALLET RETRO PETALS,624.36,312.18,50.0,1490
DOG TOY WITH PINK CROCHET SKIRT,623.26,311.63,50.0,166
RED CHARLIE+LOLA PERSONAL DOORSIGN,622.64,311.32,50.0,1256
BLACK CHAMPAGNE GLASS,621.87,310.935,50.0,1517
COOKING SET RETROSPOT,621.66,310.83,50.0,66
CHERUB HEART DECORATION GOLD,620.45,310.225,50.0,719
TRIANGULAR POUFFE VINTAGE ,620.4,310.2,50.0,44
RED DRAGONFLY HELICOPTER,620.1,310.05,50.0,78
PACK OF 12 CIRCUS PARADE TISSUES ,618.42,309.21,50.0,2024
RETRO MOD TRAY,618.13,309.065,50.0,739
PAPERWEIGHT VINTAGE COLLAGE,617.38,308.69,50.0,487
CARD WEDDING DAY,615.24,307.62,50.0,1506
SMALL YELLOW BABUSHKA NOTEBOOK ,614.63,307.315,50.0,918
SILK PURSE BABUSHKA BLUE,614.0,307.0,50.0,184
LAUREL HEART ANTIQUE GOLD,613.51,306.755,50.0,518
PINK DOG BOWL,613.24,306.62,50.0,436
WOODLAND STORAGE BOX LARGE ,612.0500000000001,306.02500000000003,50.0,227
POTTING SHED SEED ENVELOPES,610.73,305.365,50.0,476
VINTAGE JINGLE BELLS WREATH,610.5,305.25,50.0,74
EDWARDIAN HEART PHOTO FRAME,610.0500000000001,305.02500000000003,50.0,147
3 RAFFIA RIBBONS VINTAGE CHRISTMAS,608.65,304.325,50.0,679
NURSE'S BAG SOFT TOY,608.5999999999999,304.29999999999995,50.0,68
BLACK TEA TOWEL CLASSIC DESIGN,608.52,304.26,50.0,694
PINK  HONEYCOMB PAPER BALL ,607.86,303.93,50.0,417
LOVE HEART NAPKIN BOX ,607.75,303.875,50.0,143
VINTAGE POST OFFICE CABINET,607.6500000000001,303.82500000000005,50.0,11
MAGIC DRAWING SLATE BAKE A CAKE ,607.62,303.81,50.0,1745
SIX DRAWER OFFICE TIDY,605.9499999999999,302.97499999999997,50.0,65
SET OF 6 GIRLS CELEBRATION CANDLES,605.44,302.72,50.0,488
CERAMIC BOWL WITH LOVE HEART DESIGN,603.89,301.945,50.0,559
DO NOT TOUCH MY STUFF DOOR HANGER ,603.86,301.93,50.0,1176
PANTRY APPLE CORER,603.4,301.7,50.0,436
FOLDING UMBRELLA BLACKBLUE POLKADOT,601.22,300.61,50.0,120
BASKET OF FLOWERS SEWING KIT,600.61,300.305,50.0,775
ENCHANTED BIRD PLANT CAGE,599.5500000000001,299.77500000000003,50.0,181
RATTLE SNAKE EGGS,599.34,299.67,50.0,762
CHILDS GARDEN TROWEL BLUE ,599.25,299.625,50.0,705
LARGE HANGING IVORY & RED WOOD BIRD,598.37,299.185,50.0,925
BUNNY WOODEN PAINTED WITH BIRD ,598.16,299.08,50.0,852
FOLDING BUTTERFLY MIRROR IVORY ,597.7800000000001,298.89000000000004,50.0,735
DRAWER KNOB VINTAGE GLASS HEXAGON,596.96,298.48,50.0,287
PAPERWEIGHT SAVE THE PLANET,596.91,298.455,50.0,329
SET OF 6 T-LIGHTS WEDDING CAKE ,595.6500000000001,297.82500000000005,50.0,243
18PC WOODEN CUTLERY SET DISPOSABLE,595.15,297.575,50.0,503
ASSORTED TUTTI FRUTTI MIRROR,594.26,297.13,50.0,490
MINI CAKE STAND T-LIGHT HOLDER,591.84,295.92,50.0,1464
SMALL STRIPES CHOCOLATE GIFT BAG ,591.25,295.625,50.0,865
PINK STITCHED WALL CLOCK,590.57,295.285,50.0,639
EMBROIDERED RIBBON REEL RUBY ,589.38,294.69,50.0,166
"METAL SIGN,CUPCAKE SINGLE HOOK",588.05,294.025,50.0,829
HAIRCLIPS FORTIES FABRIC ASSORTED,587.86,293.93,50.0,1346
LARGE APOTHECARY MEASURING JAR ,587.2,293.6,50.0,50
SET/4 RED MINI ROSE CANDLE IN BOWL,586.55,293.275,50.0,445
S/15 SILVER GLASS BAUBLES IN BAG,586.46,293.23,50.0,502
PINK LOVE HEART SHAPE CUP,585.78,292.89,50.0,702
SET OF 4 FAIRY CAKE PLACEMATS,585.0,292.5,50.0,156
MIRROR MOSAIC HURRICANE LAMP ,584.9,292.45,50.0,286
SMALL ROUND CUT GLASS CANDLESTICK,584.65,292.325,50.0,129
TRAVEL CARD WALLET VINTAGE LEAF,581.7,290.85,50.0,1385
CHOCOLATE 1 WICK MORRIS BOX CANDLE,581.58,290.79,50.0,360
STARS GIFT TAPE ,581.0600000000001,290.53000000000003,50.0,1368
HEART STRING MEMO HOLDER HANGING,580.94,290.47,50.0,626
FRENCH BLUE METAL DOOR SIGN 9,579.4,289.7,50.0,464
JARDIN ETCHED GLASS CHEESE DISH,579.35,289.675,50.0,221
POCKET BAG BLUE PAISLEY RED SPOT,578.41,289.205,50.0,480
BLUE FELT EASTER EGG BASKET,577.5,288.75,50.0,350
ANTIQUE GLASS HEART DECORATION ,577.1999999999999,288.59999999999997,50.0,296
CUSHION COVER PINK UNION JACK,576.64,288.32,50.0,108
PIN CUSHION BABUSHKA RED,576.3100000000001,288.15500000000003,50.0,187
SMALL MEDINA STAMPED METAL BOWL ,575.41,287.705,50.0,764
VINTAGE CARAVAN GREETING CARD ,574.0600000000001,287.03000000000003,50.0,1406
MAGNETS PACK OF 4 RETRO PHOTO,572.8199999999999,286.40999999999997,50.0,1182
MAGNETS PACK OF 4 VINTAGE LABELS ,569.75,284.875,50.0,1223
CHRISTMAS TREE PAINTED ZINC ,569.29,284.645,50.0,2283
CHOC TRUFFLE GOLD TRINKET POT ,569.13,284.565,50.0,389
HANGING BAUBLE T-LIGHT HOLDER SMALL,569.1,284.55,50.0,259
ELEPHANT CARNIVAL POUFFE,568.1,284.05,50.0,38
GLITTER CHRISTMAS TREE WITH BELLS,567.79,283.895,50.0,615
BATHROOM METAL SIGN ,566.8,283.4,50.0,424
MIRROR MOSAIC GOBLET CANDLE HOLDER,566.5,283.25,50.0,506
CURIOUS IMAGES GIFT WRAP SET,566.4,283.2,50.0,597
HANGING METAL RABBIT DECORATION,566.25,283.125,50.0,453
PINK PAISLEY SQUARE TISSUE BOX ,564.48,282.24,50.0,1364
EASTER DECORATION HANGING BUNNY,563.35,281.675,50.0,1861
IVORY RETRO KITCHEN WALL CLOCK,559.5,279.75,50.0,70
GREEN ROSE WASHBAG,558.75,279.375,50.0,149
HYACINTH BULB T-LIGHT CANDLES,557.76,278.88,50.0,1328
PARTY CONES CANDY TREE DECORATION,557.28,278.64,50.0,696
VINTAGE BEAD PINK SCARF ,557.1,278.55,50.0,330
EDWARDIAN PHOTO FRAME,556.25,278.125,50.0,89
THREE MINI HANGING FRAMES,556.1,278.05,50.0,134
LARGE STRIPES CHOCOLATE GIFT BAG,553.75,276.875,50.0,443
CHILDRENS GARDEN GLOVES PINK,553.5,276.75,50.0,458
FELTCRAFT DOLL MARIA,553.1,276.55,50.0,194
MEDIUM PARLOUR PICTURE FRAME ,550.0,275.0,50.0,136
PACK OF 12 VINTAGE LEAF TISSUES ,549.6899999999999,274.84499999999997,50.0,1487
BIRTHDAY PARTY CORDON BARRIER TAPE,548.63,274.315,50.0,436
ASSTD MULTICOLOUR CIRCLES MUG,548.37,274.185,50.0,1375
ROMANTIC IMAGES NOTEBOOK SET,547.25,273.625,50.0,409
CARROT CHARLIE+LOLA COASTER SET,547.24,273.62,50.0,426
LARGE YELLOW BABUSHKA NOTEBOOK ,546.88,273.44,50.0,554
BLUE CALCULATOR RULER,546.76,273.38,50.0,462
ENAMEL PINK COFFEE CONTAINER,546.21,273.105,50.0,603
WRAP BIRD GARDEN ,546.0,273.0,50.0,1300
SILVER T-LIGHT SETTING,545.45,272.725,50.0,91
ASSTD FRUIT+FLOWERS FRIDGE MAGNETS,545.16,272.58,50.0,2244
DECORATIVE PLANT POT WITH FRIEZE,544.5,272.25,50.0,70
DECORATION WHITE CHICK MAGIC GARDEN,544.09,272.045,50.0,645
PINK PADDED MOBILE,544.0,272.0,50.0,128
FELT FARM ANIMAL RABBIT,543.9399999999999,271.96999999999997,50.0,722
SILVER CHRISTMAS TREE BAUBLE STAND ,543.35,271.675,50.0,33
SET OF 6 CAKE CHOPSTICKS,543.07,271.535,50.0,418
MOODY BOY  DOOR HANGER ,542.75,271.375,50.0,1109
GIFT BAG PSYCHEDELIC APPLES,542.46,271.23,50.0,834
SEWING SUSAN 21 NEEDLE SET,542.24,271.12,50.0,626
BLUE PAISLEY JOURNAL ,541.97,270.985,50.0,217
FRENCH FLORAL CUSHION COVER ,541.75,270.875,50.0,605
PORCELAIN BUTTERFLY OIL BURNER,540.5500000000001,270.27500000000003,50.0,193
12 DAISY PEGS IN WOOD BOX,539.55,269.775,50.0,327
CHILDS GARDEN SPADE BLUE,539.1,269.55,50.0,261
GARDEN PATH JOURNAL,534.46,267.23,50.0,218
MULTICOLOUR 3D BALLS GARLAND,532.95,266.475,50.0,209
SET/4 COLOURFUL MIXING BOWLS,532.11,266.055,50.0,57
LOVE HEART SOCK HANGER,531.9,265.95,50.0,334
RUSTIC STRAWBERRY JAM POT LARGE ,531.84,265.92,50.0,261
MAGIC GARDEN FELT GARLAND ,531.78,265.89,50.0,266
PASTEL COLOUR HONEYCOMB FAN,531.6899999999999,265.84499999999997,50.0,873
WOODLAND SMALL RED FELT HEART,531.6600000000001,265.83000000000004,50.0,666
CREAM SLICE FLANNEL CHOCOLATE SPOT ,530.95,265.475,50.0,193
WRAP WEDDING DAY,528.5,264.25,50.0,1325
SUNFLOWER DECORATIVE PARASOL,528.45,264.225,50.0,87
CHRISTMAS MUSICAL ZINC STAR,528.2099999999999,264.10499999999996,50.0,1489
WEEKEND BAG VINTAGE ROSE PAISLEY,527.85,263.925,50.0,69
SMALL SKULL WINDMILL,527.53,263.765,50.0,437
RED FLOCK LOVE HEART PHOTO FRAME,527.04,263.52,50.0,1034
BEADED CRYSTAL HEART PINK LARGE,526.38,263.19,50.0,552
RECYCLED PENCIL WITH RABBIT ERASER,525.75,262.875,50.0,2665
WHITE BELL HONEYCOMB PAPER GARLAND ,525.3,262.65,50.0,330
WRAP MONSTER FUN ,525.0,262.5,50.0,1250
SET 12 VINTAGE DOILY CHALK ,523.74,261.87,50.0,1247
BLUE TEA TOWEL CLASSIC DESIGN,523.52,261.76,50.0,448
FUSCHIA RETRO BAR STOOL,523.3000000000001,261.65000000000003,50.0,14
TREE T-LIGHT HOLDER WILLIE WINKIE,522.74,261.37,50.0,352
METAL TUBE CHIME ON BAMBOO,522.5600000000001,261.28000000000003,50.0,488
EAU DE NILE JEWELLED PHOTOFRAME,522.45,261.225,50.0,297
EGG CUP NATURAL CHICKEN,521.73,260.865,50.0,841
SQUARE MINI PORTRAIT FRAME,520.9499999999999,260.47499999999997,50.0,269
GREEN GOOSE FEATHER CHRISTMAS TREE ,520.6500000000001,260.32500000000005,50.0,167
URBAN BLACK RIBBONS ,520.47,260.235,50.0,448
DANISH ROSE BEDSIDE CABINET,519.35,259.675,50.0,13
FELT FARM ANIMAL WHITE BUNNY ,518.77,259.385,50.0,1393
SET OF 4 NAPKIN CHARMS STARS   ,516.8,258.4,50.0,253
MINI JIGSAW BAKE A CAKE ,516.61,258.305,50.0,1436
CUT GLASS T-LIGHT HOLDER OCTAGON,516.45,258.225,50.0,243
PINK POT PLANT CANDLE,516.25,258.125,50.0,189
GLASS SPHERE CANDLE STAND MEDIUM,516.2,258.1,50.0,96
CHILDS GARDEN TROWEL PINK,515.9499999999999,257.97499999999997,50.0,607
S/12 MINI RABBIT EASTER,515.4,257.7,50.0,324
JIGSAW RABBIT AND BIRDHOUSE,515.29,257.645,50.0,541
SET OF 2 ROUND TINS CAMEMBERT ,515.1800000000001,257.59000000000003,50.0,242
PACK OF 6 PANETTONE GIFT BOXES,513.9100000000001,256.95500000000004,50.0,226
GLASS TWIST BON BON JAR,512.85,256.425,50.0,69
BLUE CHARLIE+LOLA PERSONAL DOORSIGN,512.8,256.4,50.0,976
HAND OPEN SHAPE GOLD,510.83,255.415,50.0,157
RED/CREAM STRIPE CUSHION COVER ,509.9,254.95,50.0,414
BLACK PIRATE TREASURE CHEST,509.37,254.685,50.0,437
GUMBALL MONOCHROME COAT RACK,508.07,254.035,50.0,463
HEART BEADED TRELLIS DECORATION,507.52000000000004,253.76000000000002,50.0,244
SHOE SHINE BOX ,507.44999999999993,253.72499999999997,50.0,51
JIGSAW TOADSTOOLS 3 PIECE,506.42999999999995,253.21499999999997,50.0,623
FIVE CATS HANGING DECORATION,506.32000000000005,253.16000000000003,50.0,172
ROSE FOLKART HEART DECORATIONS,504.64,252.32,50.0,423
LAUREL STAR ANTIQUE SILVER ,504.6,252.3,50.0,404
BLACK CHRISTMAS TREE 120CM,503.85,251.925,50.0,209
SINGLE WIRE HOOK PINK HEART,503.83,251.915,50.0,407
UNION STRIPE CUSHION COVER ,503.75,251.875,50.0,403
SILVER GLASS T-LIGHT SET,502.47999999999996,251.23999999999998,50.0,196
PACK OF 12 STICKY BUNNIES,501.8,250.9,50.0,772
LIPSTICK PEN BABY PINK,500.33,250.165,50.0,1199
12 RED ROSE PEG PLACE SETTINGS,500.0,250.0,50.0,400
CHARLIE+LOLA RED HOT WATER BOTTLE ,499.78,249.89,50.0,174
HANGING HEART BONHEUR,499.22999999999996,249.61499999999998,50.0,591
WHITE GOOSE FEATHER TREE 60CM ,499.2,249.6,50.0,256
PINK PAISLEY ROSE GIFT WRAP,498.5,249.25,50.0,1225
SET/6 PINK BIRD T-LIGHT CANDLES,497.21,248.605,50.0,355
IVORY LOVE BIRD CANDLE,496.72,248.36,50.0,502
CORONA MEXICAN TRAY,496.25,248.125,50.0,143
WALL ART SPACEBOY,495.48,247.74,50.0,156
GIFT BAG BIRTHDAY,494.83000000000004,247.41500000000002,50.0,761
ASSORTED TUTTI FRUTTI NOTEBOOK,493.5,246.75,50.0,235
METAL SIGN HIS DINNER IS SERVED,493.39000000000004,246.69500000000002,50.0,505
"DECORATION , WOBBLY RABBIT , METAL ",491.7,245.85,50.0,298
ENVELOPE 50 BLOSSOM IMAGES,491.55,245.775,50.0,947
GARAGE KEY FOB,491.15,245.575,50.0,733
ABSTRACT CIRCLES SKETCHBOOK ,491.13,245.565,50.0,128
VINTAGE COFFEE GRINDER BOX,490.65,245.325,50.0,103
WALL MIRROR RECTANGLE DIAMANTE PINK,489.9000000000001,244.95000000000005,50.0,122
CHILDS GARDEN SPADE PINK,488.70000000000005,244.35000000000002,50.0,237
BLUE ROSE FABRIC MIRROR,488.59,244.295,50.0,409
CARD DOG AND BALL ,487.08,243.54,50.0,1170
PARTY INVITES DINOSAURS,487.04999999999995,243.52499999999998,50.0,573
DINOSAUR HEIGHT CHART STICKER SET,486.75000000000006,243.37500000000003,50.0,165
FRENCH STYLE EMBOSSED HEART CABINET,485.9,242.95,50.0,23
DANISH ROSE TRINKET TRAYS,484.63,242.315,50.0,261
HENRIETTA HEN MUG ,483.45000000000005,241.72500000000002,50.0,293
EASTER TIN CHICKS IN GARDEN,481.8,240.9,50.0,292
EMPIRE BIRTHDAY CARD,481.29,240.645,50.0,1143
COSY HOUR GIANT TUBE MATCHES,480.75,240.375,50.0,197
GLASS JAR KINGS CHOICE,480.74000000000007,240.37000000000003,50.0,162
GLASS BONNE JAM JAR,480.1,240.05,50.0,118
PARTY CONES CARNIVAL ASSORTED,479.7,239.85,50.0,402
CLASSIC GLASS SWEET JAR,479.45,239.725,50.0,119
SET/6 FRUIT SALAD  PAPER PLATES,479.25,239.625,50.0,1143
BLUE NEW BAROQUE CANDLESTICK CANDLE,478.15,239.075,50.0,439
TUMBLER NEW ENGLAND,478.14,239.07,50.0,1226
PINK HEART SHAPE PHOTO FRAME,478.0,239.0,50.0,308
SNOWSTORM PHOTO FRAME FRIDGE MAGNET,477.96999999999997,238.98499999999999,50.0,577
CHRISTMAS TREE STAR DECORATION,477.96,238.98,50.0,1138
SET OF 2 ROUND TINS DUTCH CHEESE,477.09000000000003,238.54500000000002,50.0,243
WALL ART ANIMALS AND NATURE ,474.75,237.375,50.0,149
EAU DE NILE HEART SHAPE PHOTO FRAME,474.45,237.225,50.0,305
4 WILDFLOWER BOTANICAL CANDLES,473.75,236.875,50.0,303
SEASIDE FLYING DISC,472.77,236.385,50.0,387
MUM'S KITCHEN CLOCK,471.90000000000003,235.95000000000002,50.0,104
ORANGE SCENTED SET/9 T-LIGHTS,471.45,235.725,50.0,573
PINK NEW BAROQUECANDLESTICK CANDLE,470.75,235.375,50.0,455
PACK OF 12 DOLLY GIRL TISSUES,469.16999999999996,234.58499999999998,50.0,1203
BUTTERFLY CROCHET FOOD COVER,468.67,234.335,50.0,123
YULETIDE IMAGES GIFT WRAP SET,467.5,233.75,50.0,630
BABY BOOM RIBBONS ,467.5,233.75,50.0,374
IVORY WIRE SWEETHEART LETTER TRAY,467.05,233.525,50.0,127
CAKE STAND VICTORIAN FILIGREE MED,466.95,233.475,50.0,74
LAUREL STAR ANTIQUE GOLD,465.81,232.905,50.0,372
PINK AND WHITE CHRISTMAS TREE 120CM,465.38,232.69,50.0,186
SET/6 COLLAGE PAPER CUPS,463.85,231.925,50.0,2199
STEEL SWEETHEART ROUND TABLE CREAM,463.45,231.725,50.0,31
PINK UNION JACK  PASSPORT COVER ,463.38,231.69,50.0,223
ASSORTED MINI MADRAS NOTEBOOK,462.59999999999997,231.29999999999998,50.0,948
BEADED PEARL HEART WHITE ON STICK,462.17,231.085,50.0,469
IVORY PAPER CUP CAKE CASES ,461.8,230.9,50.0,868
FLOOR CUSHION ELEPHANT CARNIVAL,461.3,230.65,50.0,54
FELT TOADSTOOL  SMALL,460.7,230.35,50.0,542
WRAP KEEP CALM BIRTHDAY,460.5,230.25,50.0,1125
SMALL PARLOUR PICTURE FRAME,459.56,229.78,50.0,164
SET OF 6 VINTAGE NOTELETS KIT,459.0,229.5,50.0,522
SET OF 6 RIBBONS PARTY,458.63,229.315,50.0,167
BLUE POLKADOT KIDS BAG,456.35999999999996,228.17999999999998,50.0,228
RETROSPOT BABUSHKA DOORSTOP,455.87,227.935,50.0,245
SWISS CHALET TREE DECORATION ,455.56999999999994,227.78499999999997,50.0,1233
ELEPHANT BIRTHDAY CARD ,454.92,227.46,50.0,1092
EMBOSSED HEART TRINKET BOX,452.34000000000003,226.17000000000002,50.0,225
WRAP MAGIC FOREST ,451.5,225.75,50.0,1075
PINK GLASS CANDLEHOLDER,450.6000000000001,225.30000000000004,50.0,156
BLACK DINER WALL CLOCK,450.5,225.25,50.0,53
CHRISTMAS GINGHAM HEART,450.48,225.24,50.0,552
SET 4 VALENTINE DECOUPAGE HEART BOX,450.38000000000005,225.19000000000003,50.0,154
SET OF 6 RIBBONS COUNTRY STYLE,449.96,224.98,50.0,164
SET OF 3 GOLD FLYING DUCKS,448.29999999999995,224.14999999999998,50.0,126
BUTTERFLIES STICKERS,447.80999999999995,223.90499999999997,50.0,525
HANGING SPRING FLOWER EGG SMALL,447.75,223.875,50.0,1163
FELT EGG COSY WHITE RABBIT ,447.46,223.73,50.0,520
ASSORTED TUTTI FRUTTI  FOB NOTEBOOK,447.36999999999995,223.68499999999997,50.0,541
LADYBIRD + BEE RAFFIA FOOD COVER,446.25,223.125,50.0,119
BLUE POLKADOT EGG CUP ,445.26,222.63,50.0,1016
ASSORTED LAQUERED INCENSE HOLDERS,443.76000000000005,221.88000000000002,50.0,2516
6PC WOOD PLATE SET DISPOSABLE,443.25,221.625,50.0,405
BISCUITS SMALL BOWL LIGHT BLUE,441.36,220.68,50.0,1039
ASSORTED TUTTI FRUTTI BRACELET,440.89,220.445,50.0,2197
SILVER JEWELLED MIRROR TRINKET TRAY,440.73999999999995,220.36999999999998,50.0,66
PAPER LANTERN 5 POINT STAR MOON ,439.90000000000003,219.95000000000002,50.0,106
SWEETHEART CREAM STEEL TABLE RECT,438.9,219.45,50.0,22
CUPID DESIGN SCENTED CANDLES,436.40000000000003,218.20000000000002,50.0,208
PINK FAIRY CAKE CUSHION COVER,436.05,218.025,50.0,123
STORAGE TIN HOME SWEET HOME,435.43,217.715,50.0,237
EGG CUP MILKMAID HELGA ,435.0,217.5,50.0,348
MINI PLAYING CARDS FUN FAIR ,434.46000000000004,217.23000000000002,50.0,1043
BLACK CHRISTMAS TREE 60CM,433.7,216.85,50.0,554
PINK/WHITE CHRISTMAS TREE 60CM,433.22,216.61,50.0,660
PIN CUSHION BABUSHKA PINK,432.99,216.495,50.0,161
RIDGED GLASS FINGER BOWL,432.53999999999996,216.26999999999998,50.0,946
PAPER LANTERN 9 POINT HOLLY STAR L,431.25,215.625,50.0,69
RIDGED BONNE JAM JAR T-LIGHT HOLDER,431.24,215.62,50.0,272
NOEL GARLAND PAINTED ZINC ,430.22999999999996,215.11499999999998,50.0,993
FOLDING UMBRELLA CHOCOLATE POLKADOT,430.06,215.03,50.0,87
CERAMIC LOVE HEART MONEY BANK,429.84999999999997,214.92499999999998,50.0,721
FLYING PIG WATERING CAN,429.25000000000006,214.62500000000003,50.0,187
MRS ROBOT SOFT TOY,428.85,214.425,50.0,143
PACK OF 12 RED APPLE TISSUES,428.01,214.005,50.0,1175
CALENDAR FAMILY FAVOURITES,427.43,213.715,50.0,153
DOG AND BALL WALL ART,425.88,212.94,50.0,252
PARTY INVITES SPACEMAN,425.84999999999997,212.92499999999998,50.0,501
BEADED CRYSTAL HEART BLUE  LARGE,425.71000000000004,212.85500000000002,50.0,479
SET OF 36 DINOSAUR PAPER DOILIES,423.4,211.7,50.0,292
UNION FLAG WINDSOCK,423.22,211.61,50.0,386
ORIGAMI JASMINE INCENSE/CANDLE SET,422.54999999999995,211.27499999999998,50.0,455
GARDEN PATH SKETCHBOOK,422.08,211.04,50.0,113
LAZER CUT NECKLACE W PASTEL BEADS,421.75,210.875,50.0,57
CHRISTMAS HANGING SNOWFLAKE,421.02000000000004,210.51000000000002,50.0,486
COCKLE SHELL DISH,420.88,210.44,50.0,289
POPPY FIELDS CHOPPING BOARD,420.75,210.375,50.0,85
RECTANGULAR SHAPED MIRROR,420.68,210.34,50.0,502
FOLDING UMBRELLA WHITE/RED POLKADOT,420.1,210.05,50.0,86
CHRISTMAS TREE HEART DECORATION,420.0,210.0,50.0,1000
BLUE SCANDINAVIAN PAISLEY WRAP,420.0,210.0,50.0,1000
BLUE PAISLEY SKETCHBOOK,419.92,209.96,50.0,110
SILVER GLITTER FLOWER VOTIVE HOLDER,419.54999999999995,209.77499999999998,50.0,1407
EGG FRYING PAN PINK ,418.05,209.025,50.0,200
COSY SLIPPER SHOES SMALL GREEN,417.44000000000005,208.72000000000003,50.0,143
DANISH ROSE DELUXE COASTER,417.34999999999997,208.67499999999998,50.0,947
FRAPPUCINO SCARF KNITTING KIT,416.78000000000003,208.39000000000001,50.0,308
VINTAGE GLASS COFFEE CADDY,416.3,208.15,50.0,74
SQUARECUSHION COVER PINK UNION FLAG,415.3,207.65,50.0,62
ENAMEL BLUE RIM BISCUIT BIN,413.95,206.975,50.0,89
PINK ENAMEL+GLASS HAIR COMB,413.7,206.85,50.0,231
PINK/PURPLE RETRO RADIO,413.00000000000006,206.50000000000003,50.0,140
DOLLY CABINET 2 DRAWERS ,412.5,206.25,50.0,33
FOLDING UMBRELLA PINKWHITE POLKADOT,412.41,206.205,50.0,84
PARTY INVITES JAZZ HEARTS,412.10999999999996,206.05499999999998,50.0,483
FRENCH PAISLEY CUSHION COVER ,411.84,205.92,50.0,452
SQUARE FLOOR CUSHION VINTAGE RED,411.35,205.675,50.0,53
WOODLAND STORAGE BOX SMALL,411.30000000000007,205.65000000000003,50.0,213
PAPERWEIGHT CHILDHOOD MEMORIES,410.72,205.36,50.0,261
RED RETROSPOT LUGGAGE TAG,410.0,205.0,50.0,328
TOAST ITS - HAPPY BIRTHDAY,410.0,205.0,50.0,328
GLITTER CHRISTMAS TREE,408.85999999999996,204.42999999999998,50.0,908
EASTER DECORATION SITTING BUNNY,408.83,204.415,50.0,503
PINK SWEETHEART BRACELET,408.75,204.375,50.0,99
DOORSTOP FOOTBALL DESIGN,408.73,204.365,50.0,135
SET/4 BADGES BALLOON GIRL,408.59,204.295,50.0,323
BUNNY DECORATION MAGIC GARDEN,408.09,204.045,50.0,485
PANTRY HOOK BALLOON WHISK ,407.68,203.84,50.0,196
HAND TOWEL PALE BLUE W FLOWERS,407.4,203.7,50.0,212
SUNSET COLOUR CHUNKY KNITTED THROW,406.8,203.4,50.0,24
PINK POLKADOT CHILDRENS UMBRELLA,406.25,203.125,50.0,125
HOME SWEET HOME HOOK,405.6,202.8,50.0,326
YELLOW SHARK HELICOPTER,405.45,202.725,50.0,51
DOLLY HONEYCOMB GARLAND,404.85,202.425,50.0,449
GINGHAM BABUSHKA DOORSTOP,404.62,202.31,50.0,210
LETS GO SHOPPING COTTON TOTE BAG,403.67,201.835,50.0,177
WHITE HAND TOWEL WITH BUTTERFLY,400.5,200.25,50.0,170
MIRRORED WALL ART SKULLS,400.0,200.0,50.0,294
S/2 ZINC HEART DESIGN PLANTERS,398.0,199.0,50.0,40
TOOTHPASTE TUBE PEN,397.25,198.625,50.0,971
SMALL SQUARE CUT GLASS CANDLESTICK,396.0,198.0,50.0,80
SET OF 4 NAPKIN CHARMS CROWNS ,394.42,197.21,50.0,255
WHITE CANDYSTUFT ARTIFICIAL FLOWER,394.15999999999997,197.07999999999998,50.0,296
BIRTHDAY BANQUET GIFT WRAP,393.5,196.75,50.0,975
EIGHT PIECE SNAKE  SET,392.5,196.25,50.0,314
FAIRY SOAP SOAP HOLDER,392.08,196.04,50.0,232
MINI JIGSAW BUNNIES,391.10999999999996,195.55499999999998,50.0,1089
ASSTD DESIGN 3D PAPER STICKERS,389.38,194.69,50.0,1162
PACK 20 ENGLISH ROSE PAPER NAPKINS,388.69,194.345,50.0,481
TABLE LAMP WHITE SHADE WOOD BASE,388.3,194.15,50.0,74
WALL ART I LOVE LONDON ,387.3,193.65,50.0,86
BELL HEART DECORATION,387.0,193.5,50.0,252
COSY SLIPPER SHOES LARGE GREEN,386.45000000000005,193.22500000000002,50.0,131
SMALL PINK GLASS SUNDAE DISH,386.25,193.125,50.0,917
PINK ROSE WASHBAG,386.25,193.125,50.0,103
MIDNIGHT GLAMOUR SCARF KNITTING KIT,385.52,192.76,50.0,277
CANDY SPOT HAND BAG,385.27000000000004,192.63500000000002,50.0,188
ASSORTED COLOUR LIZARD SUCTION HOOK,385.02000000000004,192.51000000000002,50.0,975
CLAM SHELL SMALL ,384.13,192.065,50.0,206
ANGEL DECORATION PAINTED ZINC ,383.95,191.975,50.0,635
ESSENTIAL BALM 3.5g TIN IN ENVELOPE,383.76,191.88,50.0,5856
GREEN FERN SKETCHBOOK ,382.46,191.23,50.0,101
SQUARECUSHION COVER PINK UNION JACK,382.14,191.07,50.0,150
CHILDS GARDEN RAKE PINK,381.6,190.8,50.0,186
PINK HEARTS LIGHT CHAIN ,381.0,190.5,50.0,196
LARGE PARLOUR PICTURE FRAME,380.7,190.35,50.0,78
MIRRORED WALL ART SNOWFLAKES,380.25,190.125,50.0,507
POPART WOODEN PENCILS ASST,380.0,190.0,50.0,8900
DARK BIRD HOUSE TREE DECORATION,377.90999999999997,188.95499999999998,50.0,1251
"DECORATION , WOBBLY CHICKEN, METAL ",377.85,188.925,50.0,229
DECORATION  BUTTERFLY  MAGIC GARDEN,377.49,188.745,50.0,449
SCANDINAVIAN 3 HEARTS NAPKIN RING,376.5,188.25,50.0,1746
BEACH HUT SHELF W 3 DRAWERS,376.5,188.25,50.0,70
RETRO PLASTIC POLKA TRAY,376.0,188.0,50.0,809
DECORATION WOBBLY RABBIT METAL ,375.57,187.785,50.0,753
ENAMEL PINK TEA CONTAINER,374.94,187.47,50.0,389
CHRYSANTHEMUM SKETCHBOOK ,374.84,187.42,50.0,96
DOLLCRAFT BOY JEAN-PAUL ,373.9,186.95,50.0,82
BLUE DRAGONFLY HELICOPTER,373.65000000000003,186.82500000000002,50.0,47
PARTY FOOD SHOPPER BAG,373.5,186.75,50.0,314
PARTY PIZZA DISH PINK POLKADOT,373.31,186.655,50.0,1049
ANIMAL STICKERS,372.33,186.165,50.0,1773
GLASS CHALICE BLUE SMALL ,372.3,186.15,50.0,680
SKULLS  DESIGN  COTTON TOTE BAG,371.25,185.625,50.0,165
T-LIGHT HOLDER SILVER HEART HANDLE,370.79999999999995,185.39999999999998,50.0,192
"CHRISTMAS GARLAND STARS,TREES",370.0,185.0,50.0,100
