Description,Total Amount,Profit,Profit Margin (%),Quantity
POTTING SHED TWINE,2158.5,1079.25,50.0,949
DOORMAT I LOVE LONDON,2157.33,1078.665,50.0,327
RUSTIC MIRROR WITH LACE HEART,2155.51,1077.755,50.0,443
HOME SWEET HOME KEY HOLDER,2154.79,1077.395,50.0,435
EMPIRE UNION JACK TV DINNER TRAY,2150.77,1075.385,50.0,811
RETROSPOT CIGAR BOX MATCHES ,2150.71,1075.355,50.0,2151
SET 20 NAPKINS FAIRY CAKES DESIGN ,2148.23,1074.115,50.0,2609
ICE CREAM BUBBLES,2147.6099999999997,1073.8049999999998,50.0,2667
PINK DOUGHNUT TRINKET POT ,2142.6,1071.3,50.0,1608
WRAP VINTAGE LEAF DESIGN,2140.92,1070.46,50.0,5326
VINTAGE UNION JACK APRON,2140.19,1070.095,50.0,307
TOADSTOOL MONEY BOX,2140.15,1070.075,50.0,745
FOLKART ZINC HEART CHRISTMAS DEC,2138.44,1069.22,50.0,2692
VINTAGE RED ENAMEL TRIM JUG ,2138.34,1069.17,50.0,582
SWALLOWS GREETING CARD,2130.63,1065.315,50.0,5361
SMALL PARISIENNE HEART PHOTO FRAME ,2125.1600000000003,1062.5800000000002,50.0,916
GLASS HEART T-LIGHT HOLDER ,2110.46,1055.23,50.0,2843
KEY RING BASEBALL BOOT UNION JACK,2105.8,1052.9,50.0,1772
WRAP POPPIES  DESIGN,2105.5,1052.75,50.0,5175
HEADS AND TAILS SPORTING FUN,2097.96,1048.98,50.0,1873
WALL TIDY RETROSPOT ,2092.56,1046.28,50.0,1685
PAPER LANTERN 9 POINT DELUXE STAR,2091.55,1045.775,50.0,347
ENAMEL COLANDER CREAM,2086.11,1043.055,50.0,434
LARGE CAKE TOWEL CHOCOLATE SPOTS,2084.1,1042.05,50.0,830
PACK OF 12 SUKI TISSUES ,2083.58,1041.79,50.0,7346
PLAYING CARDS JUBILEE UNION JACK,2082.48,1041.24,50.0,1668
DOG LICENCE WALL ART,2081.64,1040.82,50.0,408
SKULL SHOULDER BAG,2081.2,1040.6,50.0,1288
CACTI T-LIGHT CANDLES,2078.66,1039.33,50.0,5217
RIBBON REEL CHRISTMAS PRESENT ,2075.39,1037.695,50.0,1227
CARD BILLBOARD FONT,2072.79,1036.395,50.0,5038
VILLAGE SHOW WALL ART,2072.42,1036.21,50.0,386
SET 12 LAVENDER  BOTANICAL T-LIGHTS,2072.15,1036.075,50.0,761
CUPBOARD 3 DRAWER MA CAMPAGNE,2070.95,1035.475,50.0,145
GROW YOUR OWN BASIL IN ENAMEL MUG,2069.4,1034.7,50.0,994
SWEETHEART WIRE WALL TIDY,2066.75,1033.375,50.0,215
VINTAGE CHRISTMAS GIFT BAG LARGE ,2066.65,1033.325,50.0,1781
CLASSIC FRENCH STYLE BASKET NATURAL,2064.4700000000003,1032.2350000000001,50.0,501
SMALL DOLLY MIX DESIGN ORANGE BOWL,2063.29,1031.645,50.0,4491
DRAWER KNOB CRACKLE GLAZE GREEN,2060.4,1030.2,50.0,1272
6 EGG HOUSE PAINTED WOOD,2058.94,1029.47,50.0,258
PINK  POLKADOT CUP,2051.4,1025.7,50.0,2574
VINTAGE BILLBOARD TEA MUG,2049.05,1024.525,50.0,1868
CERAMIC CAKE DESIGN SPOTTED MUG,2043.0,1021.5,50.0,1404
PARTY CONES CANDY ASSORTED,2042.69,1021.345,50.0,1729
RED GINGHAM TEDDY BEAR ,2041.7800000000002,1020.8900000000001,50.0,726
 RED SPOT GIFT BAG LARGE,2041.0,1020.5,50.0,1700
STAR WOODEN CHRISTMAS DECORATION,2040.81,1020.405,50.0,2445
SMALL RED RETROSPOT MUG IN BOX ,2034.43,1017.215,50.0,874
MAKE YOUR OWN FLOWERPOWER CARD KIT,2030.6100000000001,1015.3050000000001,50.0,867
SLATE TILE NATURAL HANGING,2029.7,1014.85,50.0,1428
S/4 VALENTINE DECOUPAGE HEART BOX,2028.05,1014.025,50.0,1369
BUTTON BOX ,2022.66,1011.33,50.0,1072
6 RIBBONS ELEGANT CHRISTMAS ,2019.23,1009.615,50.0,1565
KEEP CALM WALL ART ,2015.97,1007.985,50.0,269
36 PENCILS TUBE SKULLS,2014.43,1007.215,50.0,1631
SMALL HEART MEASURING SPOONS,2013.7299999999998,1006.8649999999999,50.0,2385
IVORY SWEETHEART WIRE LETTER RACK ,2013.51,1006.755,50.0,545
MA CAMPAGNE CUTLERY BOX,2012.5,1006.25,50.0,138
WRAP CHRISTMAS VILLAGE,2003.92,1001.96,50.0,4876
PACK OF 12 RED RETROSPOT TISSUES ,2003.31,1001.655,50.0,6523
HERB MARKER BASIL,2000.3500000000001,1000.1750000000001,50.0,3329
HANGING MINI COLOURED BOTTLES,2000.2199999999998,1000.1099999999999,50.0,3370
DRAWER KNOB CRACKLE GLAZE PINK,1997.7,998.85,50.0,1234
TOILET METAL SIGN,1997.13,998.565,50.0,3749
6 CHOCOLATE LOVE HEART T-LIGHTS,1994.2600000000002,997.1300000000001,50.0,1018
KNEELING MAT HOUSEWORK  DESIGN,1993.91,996.955,50.0,1481
ASSORTED COLOUR T-LIGHT HOLDER,1990.97,995.485,50.0,3361
T-LIGHT HOLDER HANGING LOVE BIRD,1988.13,994.065,50.0,539
SET OF 6 T-LIGHTS CACTI ,1987.93,993.965,50.0,775
GINGHAM RECIPE BOOK BOX,1986.75,993.375,50.0,413
S/4 CACTI CANDLES,1985.67,992.835,50.0,497
FUNKY WASHING UP GLOVES ASSORTED,1984.2600000000002,992.1300000000001,50.0,973
LETTER HOLDER HOME SWEET HOME,1984.06,992.03,50.0,596
SET/20 STRAWBERRY PAPER NAPKINS ,1982.08,991.04,50.0,2494
SET OF 2 CERAMIC CHRISTMAS REINDEER,1981.6299999999999,990.8149999999999,50.0,1435
BLUE COAT RACK PARIS FASHION,1979.64,989.82,50.0,428
PACK OF 6 SANDCASTLE FLAGS ASSORTED,1973.75,986.875,50.0,2397
WHITE LOVEBIRD LANTERN,1973.6000000000001,986.8000000000001,50.0,688
CERAMIC STRAWBERRY DESIGN MUG,1973.1699999999998,986.5849999999999,50.0,1749
TEA TIME TEAPOT IN GIFT BOX,1972.46,986.23,50.0,338
36 PENCILS TUBE WOODLAND,1971.93,985.965,50.0,1597
LE JARDIN BOTANIQUE CUSHION COVER,1970.73,985.365,50.0,527
GLASS  SONGBIRD STORAGE JAR,1965.3,982.65,50.0,165
ROLL WRAP 50'S RED CHRISTMAS ,1964.76,982.38,50.0,1596
BAKING MOULD ROSE MILK CHOCOLATE,1964.25,982.125,50.0,673
"KEY FOB , SHED",1963.03,981.515,50.0,3087
WHITE BROCANTE SOAP DISH,1960.2000000000003,980.1000000000001,50.0,684
STORAGE TIN VINTAGE LEAF,1955.1299999999999,977.5649999999999,50.0,765
ASSTD DESIGN RACING CAR PEN,1953.0,976.5,50.0,1252
SOAP DISH BROCANTE,1948.3500000000001,974.1750000000001,50.0,693
FILIGREE HEART BUTTERFLY WHITE ,1947.06,973.53,50.0,1592
RED SPOT PAPER GIFT BAG,1944.08,972.04,50.0,2444
SET 8 CANDLES VINTAGE DOILY,1941.75,970.875,50.0,1029
VINTAGE RED ENAMEL TRIM MUG ,1941.7,970.85,50.0,1634
3 TIER SWEETHEART GARDEN SHELF,1938.2500000000002,969.1250000000001,50.0,55
BIRDHOUSE GARDEN MARKER ,1936.85,968.425,50.0,1417
BAKING MOULD TOFFEE CUP CHOCOLATE,1935.6000000000001,967.8000000000001,50.0,866
KEY RING BASEBALL BOOT ASSORTED ,1935.05,967.525,50.0,1585
FLORAL FOLK STATIONERY SET,1934.8500000000001,967.4250000000001,50.0,1366
JUMBO BAG CHARLIE AND LOLA TOYS,1934.75,967.375,50.0,922
SEWING BOX RETROSPOT DESIGN ,1931.75,965.875,50.0,205
NOEL WOODEN BLOCK LETTERS ,1930.89,965.445,50.0,333
3D VINTAGE CHRISTMAS STICKERS ,1930.38,965.19,50.0,1522
36 FOIL STAR CAKE CASES ,1929.14,964.57,50.0,1005
CHOCOLATE BOX RIBBONS ,1926.33,963.165,50.0,1580
CHILDREN'S CIRCUS PARADE MUG,1924.48,962.24,50.0,1192
BLUE DRAWER KNOB ACRYLIC EDWARDIAN,1924.18,962.09,50.0,1574
STAR WREATH DECORATION WITH BELL,1923.19,961.595,50.0,1595
SKETCHBOOK MAGNETIC SHOPPING LIST,1921.24,960.62,50.0,1332
WRAP DOILEY DESIGN,1915.5,957.75,50.0,4675
"FANCY FONT BIRTHDAY CARD, ",1910.88,955.44,50.0,4740
HANGING HEART WITH BELL,1907.83,953.915,50.0,4113
RIBBON REEL POLKADOTS ,1902.3,951.15,50.0,1182
MAKE YOUR OWN MONSOON CARD KIT,1898.8300000000002,949.4150000000001,50.0,833
REGENCY CAKE FORK,1896.6,948.3,50.0,1608
ZINC T-LIGHT HOLDER STAR LARGE,1896.54,948.27,50.0,2030
WHITE WIRE EGG HOLDER,1896.15,948.075,50.0,303
IVORY REFECTORY CLOCK,1894.6999999999998,947.3499999999999,50.0,202
WRAP 50'S  CHRISTMAS,1892.46,946.23,50.0,4563
FLUTED ANTIQUE CANDLE HOLDER,1888.31,944.155,50.0,2313
CARDHOLDER HOLLY WREATH METAL,1886.08,943.04,50.0,506
AIRLINE BAG VINTAGE JET SET RED,1882.84,941.42,50.0,448
SET OF 3 COLOURED  FLYING DUCKS,1882.6499999999999,941.3249999999999,50.0,393
3D TRADITIONAL CHRISTMAS STICKERS,1882.31,941.155,50.0,1471
DOLLY GIRL CHILDRENS CUP,1881.3899999999999,940.6949999999999,50.0,1549
TRAVEL CARD WALLET VINTAGE TICKET,1880.16,940.08,50.0,4552
BAKING MOULD HEART WHITE CHOCOLATE,1878.6100000000001,939.3050000000001,50.0,794
STAR T-LIGHT HOLDER WILLIE WINKIE,1875.06,937.53,50.0,1142
WOODLAND  HEIGHT CHART STICKERS ,1874.4,937.2,50.0,672
CHINESE DRAGON PAPER LANTERNS,1870.7,935.35,50.0,5524
HANGING JAM JAR T-LIGHT HOLDERS,1867.33,933.665,50.0,2413
JAZZ HEARTS PURSE NOTEBOOK,1867.05,933.525,50.0,4365
KEY CABINET MA CAMPAGNE,1865.6499999999999,932.8249999999999,50.0,191
VINTAGE JINGLE BELLS HEART,1864.5,932.25,50.0,226
ALUMINIUM STAMPED HEART,1862.5100000000002,931.2550000000001,50.0,775
CERAMIC STRAWBERRY MONEY BOX,1859.4,929.7,50.0,804
DOLLY GIRL CHILDRENS BOWL,1854.8500000000001,927.4250000000001,50.0,1553
HEART WOODEN CHRISTMAS DECORATION,1854.54,927.27,50.0,2124
OVEN MITT APPLES DESIGN,1850.66,925.33,50.0,1298
HOT WATER BOTTLE SEX BOMB,1843.55,921.775,50.0,435
CERAMIC CAKE BOWL + HANGING CAKES,1841.0,920.5,50.0,668
PARLOUR CERAMIC WALL HOOK,1840.0,920.0,50.0,448
LE GRAND TRAY CHIC SET,1837.5,918.75,50.0,147
EASTER TIN BUNNY BOUQUET,1832.7,916.35,50.0,1150
SMALL DECO JEWELLERY STAND,1831.65,915.825,50.0,229
CHRISTMAS RETROSPOT ANGEL WOOD,1827.4199999999998,913.7099999999999,50.0,2238
ENGLISH ROSE GARDEN SECATEURS,1826.78,913.39,50.0,1958
RIBBON REEL MAKING SNOWMEN ,1825.46,912.73,50.0,1102
ROCKING HORSE RED CHRISTMAS ,1813.55,906.775,50.0,2207
SET 12 COLOUR PENCILS SPACEBOY ,1807.8500000000001,903.9250000000001,50.0,2785
RED RETROSPOT APRON ,1802.8500000000001,901.4250000000001,50.0,303
HANGING CHICK CREAM DECORATION,1802.35,901.175,50.0,1243
POPPY'S PLAYHOUSE BATHROOM,1800.9,900.45,50.0,879
REX CASH+CARRY JUMBO SHOPPER,1798.35,899.175,50.0,1893
SET OF 6 T-LIGHTS TOADSTOOLS,1796.64,898.32,50.0,676
TRAVEL CARD WALLET I LOVE LONDON,1788.72,894.36,50.0,4396
SET OF 16 VINTAGE ROSE CUTLERY,1787.85,893.925,50.0,147
VINTAGE UNION JACK CUSHION COVER,1785.0,892.5,50.0,364
METAL SIGN NEIGHBOURHOOD WITCH ,1784.7000000000003,892.3500000000001,50.0,877
SET 36 COLOUR PENCILS SPACEBOY ,1783.97,891.985,50.0,1505
MAGIC DRAWING SLATE PURDEY,1782.18,891.09,50.0,4721
SWISS ROLL TOWEL PINK  SPOTS,1782.18,891.09,50.0,666
WATERING CAN GARDEN MARKER,1778.1,889.05,50.0,1290
"FEATHER PEN,HOT PINK",1777.61,888.805,50.0,3621
MINI CAKE STAND WITH HANGING CAKES,1775.05,887.525,50.0,1297
SET 12 RETRO WHITE CHALK STICKS,1771.54,885.77,50.0,4363
DRAWER KNOB CRACKLE GLAZE BLUE,1761.69,880.845,50.0,1085
RETROSPOT SMALL TUBE MATCHES,1754.9,877.45,50.0,1066
IF YOU CAN'T STAND THE HEAT MUG,1752.34,876.17,50.0,1586
OCEAN SCENT CANDLE IN JEWELLED BOX,1749.94,874.97,50.0,968
MODERN FLORAL STATIONERY SET,1745.05,872.525,50.0,1219
WRAP I LOVE LONDON ,1742.5,871.25,50.0,4425
CHRISTMAS GINGHAM STAR,1736.97,868.485,50.0,2049
FELTCRAFT BOY JEAN-PAUL KIT,1735.98,867.99,50.0,354
RED PAPER PARASOL,1735.74,867.87,50.0,630
MAGIC DRAWING SLATE SPACEBOY ,1735.5,867.75,50.0,4331
BROCANTE COAT RACK,1734.05,867.025,50.0,205
SET OF 4 NAPKIN CHARMS HEARTS,1733.37,866.685,50.0,763
CARD HOLDER GINGHAM HEART,1732.41,866.205,50.0,605
PEACE WOODEN BLOCK LETTERS,1731.3600000000001,865.6800000000001,50.0,348
FILIGREE HEART BIRD WHITE ,1726.3,863.15,50.0,1397
RED STAR CARD HOLDER,1723.79,861.895,50.0,801
VINTAGE GLASS T-LIGHT HOLDER,1723.6200000000001,861.8100000000001,50.0,2130
SET OF 12 T-LIGHTS VINTAGE DOILY,1721.6999999999998,860.8499999999999,50.0,918
CARD DOLLY GIRL ,1721.3700000000001,860.6850000000001,50.0,4319
DAIRY MAID STRIPE MUG,1721.0900000000001,860.5450000000001,50.0,1907
MONSTERS STENCIL CRAFT,1720.42,860.21,50.0,1398
FAIRY TALE COTTAGE NIGHT LIGHT,1719.1499999999999,859.5749999999999,50.0,913
EASTER TIN KEEPSAKE,1718.85,859.425,50.0,1081
IVORY EMBROIDERED QUILT ,1715.9,857.95,50.0,46
MINIATURE ANTIQUE ROSE HOOK IVORY,1715.7,857.85,50.0,2070
12 PENCILS TALL TUBE SKULLS,1709.9099999999999,854.9549999999999,50.0,2019
METAL SIGN EMPIRE TEA,1706.8100000000002,853.4050000000001,50.0,1495
LAVENDER SCENTED FABRIC HEART,1705.28,852.64,50.0,1352
TEA PARTY BIRTHDAY CARD,1702.79,851.395,50.0,4165
STRAWBERRY RAFFIA FOOD COVER,1702.65,851.325,50.0,495
RED RETROSPOT OVEN GLOVE DOUBLE,1699.2000000000003,849.6000000000001,50.0,576
GEORGIAN TRINKET BOX,1694.0,847.0,50.0,142
KINGS CHOICE GIANT TUBE MATCHES,1691.25,845.625,50.0,731
HOT STUFF HOT WATER BOTTLE,1689.9,844.95,50.0,528
WRAP SUKI AND FRIENDS,1687.5,843.75,50.0,4075
PINK  HEART SHAPE LOVE BUCKET ,1686.5200000000002,843.2600000000001,50.0,1016
KNICKERBOCKERGLORY MAGNET ASSORTED ,1679.3400000000001,839.6700000000001,50.0,2106
LED TEA LIGHTS,1679.24,839.62,50.0,596
PACK OF 20 SKULL PAPER NAPKINS,1675.24,837.62,50.0,2068
I CAN ONLY PLEASE ONE PERSON MUG,1668.89,834.445,50.0,1357
REGENCY TEA SPOON,1666.8,833.4,50.0,1404
WOODEN TREE CHRISTMAS SCANDINAVIAN,1665.1599999999999,832.5799999999999,50.0,4808
MINI CAKE STAND  HANGING STRAWBERY,1665.08,832.54,50.0,1248
PACK OF 6 SKULL PAPER PLATES,1663.3,831.65,50.0,2194
AFGHAN SLIPPER SOCK PAIR,1662.95,831.475,50.0,511
VINTAGE PAISLEY STATIONERY SET,1658.69,829.345,50.0,1163
LOVE HEART POCKET WARMER,1657.7,828.85,50.0,2620
SET 12 KIDS  WHITE CHALK STICKS,1653.24,826.62,50.0,4095
GREEN POLKADOT BOWL,1649.06,824.53,50.0,1373
DOORMAT NEIGHBOURHOOD WITCH ,1645.67,822.835,50.0,253
BROCANTE SHELF WITH HOOKS,1645.45,822.725,50.0,155
TEA TIME TABLE CLOTH,1642.68,821.34,50.0,180
DOCTOR'S BAG SOFT TOY,1640.1799999999998,820.0899999999999,50.0,174
VINTAGE BILLBOARD LOVE/HATE MUG,1637.71,818.855,50.0,1535
3 RAFFIA RIBBONS 50'S CHRISTMAS ,1632.4,816.2,50.0,1792
PETIT TRAY CHIC,1629.83,814.915,50.0,1007
MINI JIGSAW SPACEBOY,1628.3,814.15,50.0,4414
SET OF 2 CERAMIC PAINTED HEARTS ,1625.8999999999999,812.9499999999999,50.0,1166
ROTATING LEAVES T-LIGHT HOLDER,1624.73,812.365,50.0,1228
GREEN POLKADOT PLATE ,1623.1,811.55,50.0,1014
RED METAL BEACH SPADE ,1613.67,806.835,50.0,1289
ROSE 3 WICK MORRIS BOX CANDLE,1611.45,805.725,50.0,1105
JINGLE BELL HEART ANTIQUE GOLD,1610.27,805.135,50.0,765
WHITE JEWELLED HEART DECORATION,1609.8,804.9,50.0,1986
T-LIGHT HOLDER SWEETHEART HANGING,1605.84,802.92,50.0,838
GENTLEMAN SHIRT REPAIR KIT ,1602.72,801.36,50.0,1992
DAIRY MAID LARGE MILK JUG,1593.45,796.725,50.0,327
SET OF 12  VINTAGE POSTCARD SET,1591.42,795.71,50.0,2130
HEART DECORATION WITH PEARLS ,1588.1599999999999,794.0799999999999,50.0,1875
BASKET OF TOADSTOOLS,1574.98,787.49,50.0,1322
SILVER STARS TABLE DECORATION,1574.6000000000001,787.3000000000001,50.0,1948
12 PENCILS TALL TUBE WOODLAND,1573.35,786.675,50.0,1851
ROBOT BIRTHDAY CARD,1573.1200000000001,786.5600000000001,50.0,3795
POMPOM CURTAIN,1570.15,785.075,50.0,337
SET 36 COLOURING PENCILS DOILY,1568.8600000000001,784.4300000000001,50.0,1294
LAUREL HEART ANTIQUE SILVER,1567.0,783.5,50.0,1290
BIRD HOUSE HOT WATER BOTTLE,1564.61,782.305,50.0,618
SKULLS PARTY BAG + STICKER SET,1562.6999999999998,781.3499999999999,50.0,982
POLYESTER FILLER PAD 45x45cm,1562.4,781.2,50.0,1008
SMALL MARSHMALLOWS PINK BOWL,1561.6299999999999,780.8149999999999,50.0,3301
3 ROSE MORRIS BOXED CANDLES,1560.64,780.32,50.0,1072
COFFEE MUG PINK PAISLEY DESIGN,1559.44,779.72,50.0,684
BLUE REFECTORY CLOCK ,1557.8999999999999,778.9499999999999,50.0,162
PARTY CHARMS 50 PIECES,1554.31,777.155,50.0,2093
RETROSPOT WOODEN HEART DECORATION,1553.9199999999998,776.9599999999999,50.0,1852
ROUND STORAGE TIN VINTAGE LEAF,1552.5099999999998,776.2549999999999,50.0,853
FAIRY CAKE BIRTHDAY CANDLE SET,1547.4,773.7,50.0,428
HOME SWEET HOME HANGING HEART,1546.4299999999998,773.2149999999999,50.0,1823
HANGING  BUTTERFLY T-LIGHT HOLDER,1541.62,770.81,50.0,1322
RED POLKADOT BEAKER ,1538.62,769.31,50.0,3822
FRENCH TOILET SIGN BLUE METAL,1536.71,768.355,50.0,1274
YELLOW GIANT GARDEN THERMOMETER,1535.5700000000002,767.7850000000001,50.0,251
SKULL AND CROSSBONES  GARLAND ,1533.9,766.95,50.0,982
HEART T-LIGHT HOLDER WILLIE WINKIE,1533.8400000000001,766.9200000000001,50.0,928
REGENCY MIRROR WITH SHUTTERS,1530.0,765.0,50.0,10
ENAMEL FIRE BUCKET CREAM,1528.73,764.365,50.0,221
MAGNETS PACK OF 4 SWALLOWS,1528.68,764.34,50.0,2545
BAKING MOULD EASTER EGG WHITE CHOC,1527.2,763.6,50.0,560
SET 36 COLOUR PENCILS DOLLY GIRL,1522.72,761.36,50.0,1296
SKULLS  WATER TRANSFER TATTOOS ,1522.3999999999999,761.1999999999999,50.0,1872
BALLOON PUMP WITH 10 BALLOONS,1521.23,760.615,50.0,779
HANGING CHICK  YELLOW DECORATION,1520.0,760.0,50.0,1088
TEA FOR ONE POLKADOT,1519.01,759.505,50.0,345
GLASS JAR DAISY FRESH COTTON WOOL,1513.2500000000002,756.6250000000001,50.0,539
DAISY GARDEN MARKER,1513.1,756.55,50.0,1078
PACK OF 12 WOODLAND TISSUES ,1512.9299999999998,756.4649999999999,50.0,5295
BOTTLE BAG RETROSPOT ,1510.89,755.445,50.0,1038
DOG BOWL VINTAGE CREAM,1507.92,753.96,50.0,354
PACK OF 12 SKULL TISSUES,1506.24,753.12,50.0,5166
CAKE STAND LOVEBIRD 2 TIER WHITE,1499.5,749.75,50.0,214
SWEETHEART WIRE FRUIT BOWL,1497.8,748.9,50.0,198
"DIAMANTE HEART SHAPED WALL MIRROR, ",1490.65,745.325,50.0,267
HEN HOUSE DECORATION,1486.65,743.325,50.0,901
BULL DOG BOTTLE TOP WALL CLOCK,1484.25,742.125,50.0,185
OFFICE MUG WARMER PINK,1482.89,741.445,50.0,553
FAIRY CAKE DESIGN UMBRELLA,1482.87,741.435,50.0,411
POSTE FRANCE CUSHION COVER,1481.25,740.625,50.0,395
CHRISTMAS GINGHAM TREE,1480.06,740.03,50.0,1744
RED COAT RACK PARIS FASHION,1479.69,739.845,50.0,327
FILIGREE HEART DAISY WHITE,1478.59,739.295,50.0,1199
PINK HANGING HEART T-LIGHT HOLDER,1476.13,738.065,50.0,823
WHITE TALL PORCELAIN T-LIGHT HOLDER,1471.3500000000001,735.6750000000001,50.0,673
ROMANTIC PINKS RIBBONS ,1471.35,735.675,50.0,1198
FRENCH LAUNDRY SIGN BLUE METAL,1465.31,732.655,50.0,919
DANISH ROSE PHOTO FRAME,1461.6,730.8,50.0,1424
ANGEL DECORATION 3 BUTTONS ,1457.52,728.76,50.0,3532
COSY HOUR CIGAR BOX MATCHES ,1456.3899999999999,728.1949999999999,50.0,1187
OFFICE MUG WARMER POLKADOT,1454.9900000000002,727.4950000000001,50.0,503
 I LOVE LONDON MINI BACKPACK,1454.0,727.0,50.0,360
RED VINTAGE SPOT BEAKER,1452.3,726.15,50.0,1782
CREAM FELT EASTER EGG BASKET,1450.2,725.1,50.0,916
CITRONELLA CANDLE FLOWERPOT,1448.1000000000001,724.0500000000001,50.0,701
VINTAGE UNION JACK PENNANT,1446.8999999999999,723.4499999999999,50.0,742
STRAWBERRY HONEYCOMB  GARLAND ,1446.6,723.3,50.0,1220
COWBOYS AND INDIANS BIRTHDAY CARD ,1444.75,722.375,50.0,3581
SET/3 OCEAN SCENT CANDLE JEWEL BOX,1443.5,721.75,50.0,350
ROCOCO WALL MIRROR WHITE,1442.25,721.125,50.0,75
OFFICE MUG WARMER CHOC+BLUE,1434.0900000000001,717.0450000000001,50.0,517
LADS ONLY TISSUE BOX,1432.04,716.02,50.0,1578
MAGIC DRAWING SLATE DOLLY GIRL ,1431.96,715.98,50.0,3514
GLASS JAR DIGESTIVE BISCUITS,1429.97,714.985,50.0,519
FOLDING BUTTERFLY MIRROR HOT PINK ,1427.99,713.995,50.0,1839
SET OF 4 SANTA PLACE SETTINGS,1427.34,713.67,50.0,1158
12 EGG HOUSE PAINTED WOOD,1425.27,712.635,50.0,111
FRENCH KITCHEN SIGN BLUE METAL,1423.89,711.945,50.0,1176
BLUE OWL SOFT TOY,1423.3500000000001,711.6750000000001,50.0,489
POTTING SHED ROSE CANDLE,1423.0300000000002,711.5150000000001,50.0,445
CARD MOTORBIKE SANTA,1420.2,710.1,50.0,3438
PAPER CHAIN KIT SKULLS ,1415.65,707.825,50.0,507
DISCO BALL CHRISTMAS DECORATION,1408.56,704.28,50.0,12714
WHEELBARROW FOR CHILDREN ,1406.4,703.2,50.0,112
SET/3 ROSE CANDLE IN JEWELLED BOX,1406.28,703.14,50.0,340
SPACEBOY CHILDRENS EGG CUP,1405.97,702.985,50.0,1118
APPLE BATH SPONGE,1400.49,700.245,50.0,1102
SET 12 COLOUR PENCILS DOLLY GIRL ,1398.35,699.175,50.0,2155
CAT BOWL VINTAGE CREAM,1396.95,698.475,50.0,431
WHITE BELL HONEYCOMB PAPER ,1391.85,695.925,50.0,925
CLASSIC FRENCH STYLE BASKET GREEN ,1388.65,694.325,50.0,331
SMALL HEART FLOWERS HOOK ,1386.75,693.375,50.0,1679
EMPIRE GIFT WRAP,1384.0,692.0,50.0,3400
WRAP PAISLEY PARK ,1375.5,687.75,50.0,3275
12 COLOURED PARTY BALLOONS,1373.3,686.65,50.0,2110
CHILDRENS TOY COOKING UTENSIL SET,1371.48,685.74,50.0,680
CAST IRON HOOK GARDEN FORK,1371.4299999999998,685.7149999999999,50.0,513
GLAMOROUS  MUG,1370.73,685.365,50.0,1269
LARGE POPCORN HOLDER ,1370.45,685.225,50.0,873
PENCIL CASE LIFE IS BEAUTIFUL,1368.2000000000003,684.1000000000001,50.0,472
TOOL BOX SOFT TOY ,1368.1399999999999,684.0699999999999,50.0,146
WOODEN REGATTA BUNTING,1362.55,681.275,50.0,229
3 WHITE CHOC MORRIS BOXED CANDLES,1362.44,681.22,50.0,884
3D CHRISTMAS STAMPS STICKERS ,1361.95,680.975,50.0,1075
ZINC  STAR T-LIGHT HOLDER ,1361.54,680.77,50.0,1186
CITRONELLA CANDLE GARDEN POT,1356.25,678.125,50.0,1085
PACK OF 6 HANDBAG GIFT BOXES,1348.95,674.475,50.0,529
MAGIC DRAWING SLATE CIRCUS PARADE  ,1348.5,674.25,50.0,3293
S/4 PINK FLOWER CANDLES IN BOWL,1348.19,674.095,50.0,807
ZINC BOX SIGN HOME,1348.01,674.005,50.0,139
IVORY WICKER HEART SMALL,1345.5,672.75,50.0,2154
CHARLIE + LOLA RED HOT WATER BOTTLE,1342.0,671.0,50.0,654
RED RETROSPOT PUDDING BOWL,1341.75,670.875,50.0,327
KINGS CHOICE TEA CADDY ,1341.2800000000002,670.6400000000001,50.0,456
WRAP VINTAGE PETALS  DESIGN,1338.0,669.0,50.0,3300
DINOSAUR KEYRINGS ASSORTED,1332.9299999999998,666.4649999999999,50.0,6462
KINGS CHOICE BISCUIT TIN,1332.6,666.3,50.0,324
DRAWER KNOB CERAMIC BLACK,1332.35,666.175,50.0,947
IVORY CAFE HANGING LAMP ,1330.5,665.25,50.0,114
VINTAGE RED TRIM ENAMEL BOWL ,1328.59,664.295,50.0,1079
SET OF 3 BABUSHKA STACKING TINS,1326.6,663.3,50.0,268
CARD BIRTHDAY COWBOY,1324.89,662.445,50.0,3367
FRYING PAN RED RETROSPOT,1324.25,662.125,50.0,383
CARD HOLDER LOVE BIRD LARGE ,1323.4,661.7,50.0,220
GIN & TONIC DIET GREETING CARD ,1320.9,660.45,50.0,3217
CARD CHRISTMAS VILLAGE,1319.4,659.7,50.0,3162
SET/6 PURPLE BUTTERFLY T-LIGHTS,1318.98,659.49,50.0,689
WOODLAND DESIGN  COTTON TOTE BAG,1318.5,659.25,50.0,586
STRAWBERRY CERAMIC TRINKET POT,1314.54,657.27,50.0,1038
CIRCUS PARADE CHILDRENS EGG CUP ,1313.59,656.795,50.0,1047
BEADED CHANDELIER T-LIGHT HOLDER,1313.29,656.645,50.0,599
36 DOILIES DOLLY GIRL,1312.25,656.125,50.0,905
CARD I LOVE LONDON ,1312.12,656.06,50.0,3309
HANGING HEN ON NEST DECORATION,1311.75,655.875,50.0,795
DIAMANTE RING ASSORTED IN BOX.,1311.3600000000001,655.6800000000001,50.0,1008
MAGNETS PACK OF 4 CHILDHOOD MEMORY,1309.9,654.95,50.0,1130
PANTRY PASTRY BRUSH,1308.3,654.15,50.0,1045
WICKER WREATH LARGE,1307.36,653.68,50.0,694
CHOCOLATE CALCULATOR,1306.73,653.365,50.0,785
STRAWBERRY BATH SPONGE ,1305.61,652.805,50.0,1029
6 RIBBONS EMPIRE  ,1304.3700000000001,652.1850000000001,50.0,1035
FRENCH BLUE METAL DOOR SIGN 1,1303.64,651.82,50.0,1040
CHRISTMAS TABLE SILVER CANDLE SPIKE,1303.54,651.77,50.0,1606
CHRISTMAS RETROSPOT STAR WOOD,1303.54,651.77,50.0,1540
SILVER MUG BONE CHINA TREE OF LIFE,1303.29,651.645,50.0,1138
BAG 500g SWIRLY MARBLES,1299.21,649.605,50.0,1377
SMALL WHITE RETROSPOT MUG IN BOX ,1298.79,649.395,50.0,711
SET OF 4 ENGLISH ROSE COASTERS,1295.59,647.795,50.0,1063
IVORY CHANDELIER T-LIGHT HOLDER,1292.97,646.485,50.0,561
APRON APPLE DELIGHT,1291.6000000000001,645.8000000000001,50.0,268
"SWISS ROLL TOWEL, CHOCOLATE  SPOTS",1291.55,645.775,50.0,789
METAL DECORATION NAUGHTY CHILDREN ,1286.56,643.28,50.0,1456
RED RETROSPOT SHOPPING BAG,1284.66,642.33,50.0,510
FOLKART STAR CHRISTMAS DECORATIONS,1282.4099999999999,641.2049999999999,50.0,3017
CABIN BAG VINTAGE PAISLEY,1279.2,639.6,50.0,64
WALL ART VINTAGE HEART,1278.87,639.435,50.0,327
FLOWER VINE RAFFIA FOOD COVER,1278.63,639.315,50.0,338
HANGING HEART MIRROR DECORATION ,1276.85,638.425,50.0,1969
PACK OF 6 LARGE FRUIT STRAWS ,1276.33,638.165,50.0,2156
ROSE SCENT CANDLE IN JEWELLED BOX,1275.92,637.96,50.0,316
TRAVEL CARD WALLET TRANSPORT,1275.6,637.8,50.0,3044
VINTAGE RED ENAMEL TRIM PLATE,1274.7,637.35,50.0,790
PACK OF 12 50'S CHRISTMAS TISSUES,1272.9299999999998,636.4649999999999,50.0,3419
MULTICOLOUR HONEYCOMB PAPER GARLAND,1272.9,636.45,50.0,1010
CARD CIRCUS PARADE,1272.27,636.135,50.0,3088
MEDINA STAMPED METAL STOOL,1268.3500000000001,634.1750000000001,50.0,33
COFFEE MUG BLUE PAISLEY DESIGN,1268.06,634.03,50.0,744
BOX OF 6 ASSORTED COLOUR TEASPOONS,1267.99,633.995,50.0,295
BALLOONS  WRITING SET ,1262.2,631.1,50.0,760
HANGING FAIRY CAKE DECORATION,1262.1000000000001,631.0500000000001,50.0,724
ASS FLORAL PRINT MULTI SCREWDRIVER,1261.69,630.845,50.0,2754
PARTY CONE CHRISTMAS DECORATION ,1260.53,630.265,50.0,1505
MOUSE TOY WITH PINK T-SHIRT,1260.05,630.025,50.0,335
CARD HOLDER LOVE BIRD SMALL,1255.76,627.88,50.0,320
PACK OF 6 SKULL PAPER CUPS,1254.74,627.37,50.0,2050
CHERRY BLOSSOM  DECORATIVE FLASK,1253.97,626.985,50.0,339
4 VANILLA BOTANICAL CANDLES,1252.5,626.25,50.0,900
SAVOY ART DECO CLOCK,1251.25,625.625,50.0,231
CARDHOLDER GINGHAM CHRISTMAS TREE,1250.84,625.42,50.0,374
POTTING SHED CANDLE CITRONELLA,1250.82,625.41,50.0,402
HEART DECORATION PAINTED ZINC ,1250.2,625.1,50.0,2024
SUNSET CHECK HAMMOCK,1249.65,624.825,50.0,167
PAPER LANTERN 9 POINT SNOW STAR ,1249.5,624.75,50.0,234
PINK PAPER PARASOL ,1248.2800000000002,624.1400000000001,50.0,428
PLAYING CARDS I LOVE LONDON ,1247.25,623.625,50.0,1065
PAPER CHAIN KIT LONDON,1246.94,623.47,50.0,438
MAKE YOUR OWN PLAYTIME CARD KIT,1245.88,622.94,50.0,628
WHITE HANGING BEADS CANDLE HOLDER,1244.95,622.475,50.0,239
VINTAGE CHRISTMAS PAPER GIFT BAG,1241.6599999999999,620.8299999999999,50.0,1563
REINDEER HEART DECORATION SILVER,1241.5900000000001,620.7950000000001,50.0,1461
CLASSIC FRENCH STYLE BASKET BROWN,1240.44,620.22,50.0,296
TV DINNER TRAY VINTAGE PAISLEY,1239.3899999999999,619.6949999999999,50.0,437
SET OF 4 KNICK KNACK TINS LEAVES ,1237.2,618.6,50.0,304
LIPSTICK PEN RED,1236.1200000000001,618.0600000000001,50.0,2812
SAVE THE PLANET COTTON TOTE BAG,1235.25,617.625,50.0,549
WOOD STAMP SET THANK YOU,1234.1000000000001,617.0500000000001,50.0,1289
TV DINNER TRAY DOLLY GIRL,1234.07,617.035,50.0,293
FRENCH ENAMEL POT W LID,1233.3100000000002,616.6550000000001,50.0,551
PIG KEYRING WITH LIGHT & SOUND ,1231.34,615.67,50.0,1316
DAIRY MAID TRADITIONAL TEAPOT ,1230.05,615.025,50.0,179
CHARLIE & LOLA WASTEPAPER BIN FLORA,1228.25,614.125,50.0,977
GLASS JAR MARMALADE ,1226.94,613.47,50.0,454
FRIDGE MAGNETS US DINER ASSORTED,1226.3999999999999,613.1999999999999,50.0,1482
SKULL DESIGN TV DINNER TRAY,1225.95,612.975,50.0,281
CALENDAR IN SEASON DESIGN,1225.49,612.745,50.0,478
MIRROR CORNICE,1223.25,611.625,50.0,83
YELLOW COAT RACK PARIS FASHION,1222.74,611.37,50.0,270
PENS ASSORTED SPACEBALL,1219.8799999999999,609.9399999999999,50.0,5636
SWALLOW WOODEN CHRISTMAS DECORATION,1218.6299999999999,609.3149999999999,50.0,1419
PORCELAIN ROSE SMALL,1218.36,609.18,50.0,1560
SILK PURSE BABUSHKA PINK,1217.68,608.84,50.0,365
MARIE ANTOINETTE TRINKET BOX GOLD,1217.6,608.8,50.0,316
GROW YOUR OWN HERBS SET OF 3,1216.3500000000001,608.1750000000001,50.0,153
SET/10 IVORY POLKADOT PARTY CANDLES,1215.81,607.905,50.0,975
SET OF 4 ROSE BOTANICAL CANDLES,1211.25,605.625,50.0,811
FRYING PAN PINK POLKADOT,1209.54,604.77,50.0,326
SINGLE WIRE HOOK IVORY HEART,1209.1499999999999,604.5749999999999,50.0,875
OVERNIGHT BAG VINTAGE ROSE PAISLEY,1207.8,603.9,50.0,244
PENNY FARTHING BIRTHDAY CARD,1203.49,601.745,50.0,2915
