Description,Total Amount,Profit,Profit Margin (%),Quantity
"PAPER CRAFT , LITTLE BIRDIE",168469.6,84234.8,50.0,80995
REGENCY CAKESTAND 3 TIER,142592.94999999998,71296.47499999999,50.0,12402
WHITE HANGING HEART T-LIGHT HOLDER,100448.15000000001,50224.075000000004,50.0,36725
JUMBO BAG RED RETROSPOT,85220.78,42610.39,50.0,46181
MEDIUM CERAMIC TOP STORAGE JAR,81416.73000000001,40708.365000000005,50.0,77916
POSTAGE,77803.96,38901.98,50.0,3120
PARTY BUNTING,68844.33,34422.165,50.0,15291
ASSORTED COLOUR BIRD ORNAMENT,56580.34,28290.17,50.0,35362
Manual,53779.93,26889.965,50.0,7173
RABBIT NIGHT LIGHT,51346.2,25673.1,50.0,27202
CHILLI LIGHTS,46286.51,23143.255,50.0,9650
PAPER CHAIN KIT 50'S CHRISTMAS ,42660.83,21330.415,50.0,15617
PICNIC BASKET WICKER 60 PIECES,39619.5,19809.75,50.0,61
BLACK RECORD COVER FRAME,39064.55,19532.275,50.0,11406
JUMBO BAG PINK POLKADOT,37289.590000000004,18644.795000000002,50.0,20165
DOORMAT KEEP CALM AND COME IN,35913.85,17956.925,50.0,5342
SPOTTY BUNTING,35539.25,17769.625,50.0,7639
WOOD BLACK BOARD ANT WHITE FINISH,34478.01,17239.005,50.0,5921
SET OF 3 CAKE TINS PANTRY DESIGN ,33347.8,16673.9,50.0,7020
JAM MAKING SET WITH JARS,32662.97,16331.485,50.0,8151
JUMBO BAG STRAWBERRY,30644.2,15322.1,50.0,16807
VICTORIAN GLASS HANGING T-LIGHT,28776.51,14388.255,50.0,22433
HEART OF WICKER LARGE,28520.95,14260.475,50.0,9591
HEART OF WICKER SMALL,28228.64,14114.32,50.0,16775
LUNCH BAG RED RETROSPOT,28048.45,14024.225,50.0,17697
SET OF 3 REGENCY CAKE TINS,26625.68,13312.84,50.0,5856
JUMBO BAG APPLES,26451.260000000002,13225.630000000001,50.0,13887
ALARM CLOCK BAKELIKE RED ,25925.2,12962.6,50.0,7221
PAPER CHAIN KIT VINTAGE CHRISTMAS,25669.27,12834.635,50.0,9433
DOORMAT RED RETROSPOT,25397.85,12698.925,50.0,3901
GIN + TONIC DIET METAL SIGN,24988.98,12494.49,50.0,11519
ROSES REGENCY TEACUP AND SAUCER ,24865.600000000002,12432.800000000001,50.0,9132
SPACEBOY LUNCH BOX ,24694.59,12347.295,50.0,13919
HOT WATER BOTTLE KEEP CALM,24426.3,12213.15,50.0,5338
NATURAL SLATE HEART CHALKBOARD ,24245.520000000004,12122.760000000002,50.0,8480
JUMBO BAG ALPHABET,24175.0,12087.5,50.0,12540
PLEASE ONE PERSON METAL SIGN,23930.920000000002,11965.460000000001,50.0,11963
RED  HARMONICA IN BOX ,23793.93,11896.965,50.0,20975
DOORMAT UNION FLAG,23697.99,11848.995,50.0,3625
JUMBO  BAG BAROQUE BLACK WHITE,23675.04,11837.52,50.0,12793
CHOCOLATE HOT WATER BOTTLE,23624.24,11812.12,50.0,5160
POPCORN HOLDER,23427.71,11713.855,50.0,30931
REGENCY TEAPOT ROSES ,23073.32,11536.66,50.0,2666
BAKING SET 9 PIECE RETROSPOT ,23007.55,11503.775,50.0,4797
DOORMAT NEW ENGLAND,22968.25,11484.125,50.0,3721
CREAM HEART CARD HOLDER,22715.57,11357.785,50.0,8195
VINTAGE UNION JACK MEMOBOARD,22709.13,11354.565,50.0,3255
RED HANGING HEART T-LIGHT HOLDER,22624.690000000002,11312.345000000001,50.0,7759
ROUND SNACK BOXES SET OF4 WOODLAND ,22175.52,11087.76,50.0,8100
SET OF TEA COFFEE SUGAR TINS PANTRY,22133.829999999998,11066.914999999999,50.0,4663
JUMBO STORAGE BAG SUKI,21790.95,10895.475,50.0,11516
DOORMAT FAIRY CAKE,21187.69,10593.845,50.0,3429
JAM MAKING SET PRINTED,21170.75,10585.375,50.0,15055
JUMBO BAG VINTAGE LEAF,20963.93,10481.965,50.0,10716
VINTAGE UNION JACK BUNTING,20962.16,10481.08,50.0,2540
ALARM CLOCK BAKELIKE GREEN,20880.4,10440.2,50.0,5641
RECIPE BOX PANTRY YELLOW DESIGN,20859.27,10429.635,50.0,7373
EDWARDIAN PARASOL NATURAL,20696.71,10348.355,50.0,3826
JUMBO BAG VINTAGE DOILY ,20674.68,10337.34,50.0,10636
CREAM SWEETHEART MINI CHEST,20562.92,10281.46,50.0,1705
SET OF 6 SPICE TINS PANTRY DESIGN,20530.0,10265.0,50.0,5372
RETROSPOT TEA SET CERAMIC 11 PC ,20470.78,10235.39,50.0,4248
COOK WITH WINE METAL SIGN ,20315.33,10157.665,50.0,10209
JUMBO SHOPPER VINTAGE RED PAISLEY,20174.23,10087.115,50.0,10518
DOLLY GIRL LUNCH BOX,20129.44,10064.72,50.0,11336
SCOTTIE DOG HOT WATER BOTTLE,20104.350000000002,10052.175000000001,50.0,4259
WOODEN PICTURE FRAME WHITE FINISH,20001.65,10000.825,50.0,8276
DOORMAT HEARTS,19948.81,9974.405,50.0,3271
RED TOADSTOOL LED NIGHT LIGHT,19844.91,9922.455,50.0,12871
LUNCH BOX I LOVE LONDON,19353.22,9676.61,50.0,11094
DOORMAT FANCY FONT HOME SWEET HOME,19157.02,9578.51,50.0,3088
JUMBO BAG OWLS,19076.92,9538.46,50.0,10466
PAPER BUNTING RETROSPOT,18791.890000000003,9395.945000000002,50.0,6879
ALARM CLOCK BAKELIKE PINK,18569.09,9284.545,50.0,5074
JUMBO BAG PINK VINTAGE PAISLEY,18429.98,9214.99,50.0,9889
LUNCH BAG APPLE DESIGN,18278.25,9139.125,50.0,11565
LUNCH BAG  BLACK SKULL.,18024.55,9012.275,50.0,11291
RED RETROSPOT CAKE STAND,17929.75,8964.875,50.0,1809
GREEN REGENCY TEACUP AND SAUCER,17806.34,8903.17,50.0,6430
JUMBO BAG 50'S CHRISTMAS ,17679.72,8839.86,50.0,8954
WOODEN FRAME ANTIQUE WHITE ,17625.070000000003,8812.535000000002,50.0,6282
ROUND SNACK BOXES SET OF 4 FRUITS ,17604.99,8802.495,50.0,6481
ROTATING SILVER ANGELS T-LIGHT HLDR,17592.52,8796.26,50.0,7907
GUMBALL COAT RACK,17580.350000000002,8790.175000000001,50.0,7688
HOMEMADE JAM SCENTED CANDLES,17521.6,8760.8,50.0,12092
FAIRY CAKE FLANNEL ASSORTED COLOUR,17304.57,8652.285,50.0,10082
LUNCH BAG CARS BLUE,17265.68,8632.84,50.0,10820
GROW A FLYTRAP OR SUNFLOWER IN TIN,17226.2,8613.1,50.0,15940
JUMBO BAG DOILEY PATTERNS,16741.260000000002,8370.630000000001,50.0,8737
COLOUR GLASS. STAR T-LIGHT HOLDER,16570.29,8285.145,50.0,5655
SET/5 RED RETROSPOT LID GLASS BOWLS,16569.58,8284.79,50.0,5882
PACK OF 72 RETROSPOT CAKE CASES,16394.53,8197.265,50.0,33693
LUNCH BAG PINK POLKADOT,16349.5,8174.75,50.0,10254
HAND WARMER OWL DESIGN,16237.630000000001,8118.8150000000005,50.0,8115
ASSORTED COLOURS SILK FAN,16044.44,8022.22,50.0,21876
MINI PAINT SET VINTAGE ,16039.24,8019.62,50.0,26076
LUNCH BAG SPACEBOY DESIGN ,15881.2,7940.6,50.0,9912
RETROSPOT HEART HOT WATER BOTTLE,15871.73,7935.865,50.0,3335
HOME BUILDING BLOCK WORD,15630.960000000001,7815.4800000000005,50.0,2654
HAND OVER THE CHOCOLATE   SIGN ,15539.11,7769.555,50.0,8164
JUMBO BAG WOODLAND ANIMALS,15511.6,7755.8,50.0,8187
HOT WATER BOTTLE TEA AND SYMPATHY,15415.22,7707.61,50.0,3736
LUNCH BAG SUKI DESIGN ,15384.05,7692.025,50.0,9601
JUMBO BAG SPACEBOY DESIGN,15331.02,7665.51,50.0,8236
EDWARDIAN PARASOL BLACK,15218.67,7609.335,50.0,2779
ANTIQUE SILVER T-LIGHT GLASS,15206.42,7603.21,50.0,12973
6 RIBBONS RUSTIC CHARM,14988.59,7494.295,50.0,8605
IVORY KITCHEN SCALES,14788.33,7394.165,50.0,1783
PINK REGENCY TEACUP AND SAUCER,14769.490000000002,7384.745000000001,50.0,5343
WOOD 2 DRAWER CABINET WHITE FINISH,14689.87,7344.935,50.0,2341
JUMBO BAG SCANDINAVIAN BLUE PAISLEY,14632.970000000001,7316.485000000001,50.0,7757
LUNCH BAG WOODLAND,14537.11,7268.555,50.0,9115
SET OF 4 PANTRY JELLY MOULDS,14180.17,7090.085,50.0,11792
HOT WATER BOTTLE I AM SO POORLY,13847.28,6923.64,50.0,2972
SMALL POPCORN HOLDER,13798.72,6899.36,50.0,18252
CHILDRENS CUTLERY POLKADOT PINK,13796.6,6898.3,50.0,3530
WORLD WAR 2 GLIDERS ASSTD DESIGNS,13586.249999999998,6793.124999999999,50.0,54415
DOORMAT ENGLISH ROSE ,13470.95,6735.475,50.0,1975
PAPER CHAIN KIT EMPIRE,13435.150000000001,6717.575000000001,50.0,4893
RED WOOLLY HOTTIE WHITE HEART.,13430.51,6715.255,50.0,3707
BREAD BIN DINER STYLE IVORY,13131.89,6565.945,50.0,847
LOVE HOT WATER BOTTLE,13115.4,6557.7,50.0,2352
JUMBO BAG PEARS,13043.24,6521.62,50.0,6733
BOX OF VINTAGE ALPHABET BLOCKS,13035.66,6517.83,50.0,1295
SET/4 WHITE RETRO STORAGE CUBES ,13007.150000000001,6503.575000000001,50.0,357
VINTAGE CHRISTMAS BUNTING,12994.77,6497.385,50.0,2755
SET OF 10 LED DOLLY LIGHTS,12985.23,6492.615,50.0,2194
HOT BATHS METAL SIGN,12832.140000000001,6416.070000000001,50.0,6415
HANGING HEART JAR T-LIGHT HOLDER,12674.72,6337.36,50.0,10980
SET 7 BABUSHKA NESTING BOXES,12665.29,6332.645,50.0,1654
CLOTHES PEGS RETROSPOT PACK 24 ,12545.38,6272.69,50.0,8418
GARDENERS KNEELING PAD KEEP CALM ,12493.48,6246.74,50.0,7740
MEMO BOARD RETROSPOT  DESIGN,12411.02,6205.51,50.0,2786
3 HOOK PHOTO SHELF ANTIQUE WHITE,12294.38,6147.19,50.0,1723
BLACK HEART CARD HOLDER,12261.9,6130.95,50.0,4844
HAND WARMER SCOTTY DOG DESIGN,12248.76,6124.38,50.0,6118
RED RETROSPOT MINI CASES,12216.8,6108.4,50.0,1712
GREY HEART HOT WATER BOTTLE,12191.15,6095.575,50.0,3156
PLASTERS IN TIN SPACEBOY,12151.8,6075.9,50.0,7664
CHRISTMAS LIGHTS 10 REINDEER,12150.0,6075.0,50.0,1572
ASSORTED COLOUR MINI CASES,12123.41,6061.705,50.0,1719
DOORMAT SPOTTY HOME SWEET HOME,12095.67,6047.835,50.0,1662
HAND WARMER BIRD DESIGN,12081.430000000002,6040.715000000001,50.0,6001
PAPER CHAIN KIT RETROSPOT,12043.210000000001,6021.6050000000005,50.0,4307
LUNCH BAG ALPHABET DESIGN,12029.06,6014.53,50.0,7554
RECYCLING BAG RETROSPOT ,11942.43,5971.215,50.0,6088
DOTCOM POSTAGE,11906.36,5953.18,50.0,16
RED KITCHEN SCALES,11895.73,5947.865,50.0,1476
FELTCRAFT CUSHION OWL,11783.05,5891.525,50.0,3284
FELTCRAFT DOLL MOLLY,11762.99,5881.495,50.0,4469
PINK HAPPY BIRTHDAY BUNTING,11688.150000000001,5844.075000000001,50.0,2287
DOUGHNUT LIP GLOSS ,11640.7,5820.35,50.0,9662
PLASTERS IN TIN WOODLAND ANIMALS,11637.43,5818.715,50.0,7307
PACK OF 60 PINK PAISLEY CAKE CASES,11629.699999999999,5814.849999999999,50.0,24264
PINK BLUE FELT CRAFT TRINKET BOX,11629.39,5814.695,50.0,10225
WOODEN ROUNDERS GARDEN SET ,11601.14,5800.57,50.0,1269
IVORY DINER WALL CLOCK,11587.2,5793.6,50.0,1426
REGENCY SUGAR BOWL GREEN,11575.54,5787.77,50.0,2956
FELTCRAFT 6 FLOWER FRIENDS,11566.39,5783.195,50.0,5890
DOORMAT WELCOME PUPPIES,11544.2,5772.1,50.0,2028
LOVE BUILDING BLOCK WORD,11535.56,5767.78,50.0,1946
ENAMEL FLOWER JUG CREAM,11444.93,5722.465,50.0,1995
WOOD S/3 CABINET ANT WHITE FINISH,11394.9,5697.45,50.0,1370
RED DINER WALL CLOCK,11074.39,5537.195,50.0,1352
STRAWBERRY CERAMIC TRINKET BOX,10895.52,5447.76,50.0,9328
JUMBO STORAGE BAG SKULLS,10890.79,5445.395,50.0,5706
PICNIC BASKET WICKER LARGE,10818.9,5409.45,50.0,1194
FELTCRAFT CUSHION RABBIT,10694.81,5347.405,50.0,3018
METAL SIGN TAKE IT OR LEAVE IT ,10647.300000000001,5323.650000000001,50.0,3690
VINTAGE SNAP CARDS,10447.42,5223.71,50.0,13336
TEA TIME PARTY BUNTING,10445.25,5222.625,50.0,2291
RED RETROSPOT PICNIC BAG,10371.66,5185.83,50.0,3758
LUNCH BAG VINTAGE DOILY ,10370.76,5185.38,50.0,6452
LUNCH BAG DOLLY GIRL DESIGN,10360.69,5180.345,50.0,6545
LUNCH BAG DOILEY PATTERN ,10331.3,5165.65,50.0,6482
ALARM CLOCK BAKELIKE IVORY,10285.61,5142.805,50.0,2728
PAPER BUNTING WHITE LACE,10264.050000000001,5132.025000000001,50.0,3779
RED RETROSPOT UMBRELLA,10247.470000000001,5123.735000000001,50.0,1846
WHITE SKULL HOT WATER BOTTLE ,10227.72,5113.86,50.0,2702
BAKING SET SPACEBOY DESIGN,10210.89,5105.445,50.0,2153
REGENCY TEA PLATE ROSES ,10190.789999999999,5095.3949999999995,50.0,6575
CLASSIC METAL BIRDCAGE PLANT HOLDER,10161.41,5080.705,50.0,928
SOLDIERS EGG CUP ,10150.22,5075.11,50.0,8821
RED RETROSPOT CHARLOTTE BAG,10125.85,5062.925,50.0,12809
BLUE HAPPY BIRTHDAY BUNTING,10107.52,5053.76,50.0,1950
TRADITIONAL WOODEN SKIPPING ROPE,10019.47,5009.735,50.0,7919
LUNCH BAG VINTAGE LEAF DESIGN,10006.45,5003.225,50.0,6225
GARDENERS KNEELING PAD CUP OF TEA ,9963.39,4981.695,50.0,6303
WOODEN UNION JACK BUNTING,9928.83,4964.415,50.0,1734
CHILDRENS CUTLERY POLKADOT BLUE,9831.4,4915.7,50.0,2524
DOORMAT BLACK FLOCK ,9822.2,4911.1,50.0,1787
JUMBO BAG VINTAGE CHRISTMAS ,9748.34,4874.17,50.0,4908
ICE CREAM SUNDAE LIP GLOSS,9668.16,4834.08,50.0,7920
LONDON BUS COFFEE MUG,9666.300000000001,4833.150000000001,50.0,4246
SET/20 RED RETROSPOT PAPER NAPKINS ,9656.789999999999,4828.3949999999995,50.0,12313
FELTCRAFT CUSHION BUTTERFLY,9655.48,4827.74,50.0,2698
DOORMAT HOME SWEET HOME BLUE ,9635.89,4817.945,50.0,1597
CHILDRENS CUTLERY RETROSPOT RED ,9603.68,4801.84,50.0,2492
COLOUR GLASS T-LIGHT HOLDER HANGING,9597.710000000001,4798.8550000000005,50.0,15611
BREAD BIN DINER STYLE RED ,9597.31,4798.655,50.0,626
PLASTERS IN TIN CIRCUS PARADE ,9596.96,4798.48,50.0,5952
NO SINGING METAL SIGN,9573.6,4786.8,50.0,4636
WOODEN CROQUET GARDEN SET,9555.98,4777.99,50.0,709
HAND WARMER UNION JACK,9550.560000000001,4775.280000000001,50.0,4746
DOORMAT WELCOME TO OUR HOME,9468.08,4734.04,50.0,1378
PLASTERS IN TIN STRONGMAN,9462.289999999999,4731.1449999999995,50.0,5885
SET/3 RED GINGHAM ROSE STORAGE BOX,9424.32,4712.16,50.0,2704
15CM CHRISTMAS GLASS BALL 20 LIGHTS,9374.7,4687.35,50.0,1266
PHOTO FRAME CORNICE,9365.78,4682.89,50.0,3206
ANTIQUE SILVER TEA GLASS ENGRAVED,9339.34,4669.67,50.0,8273
KNITTED UNION FLAG HOT WATER BOTTLE,9329.17,4664.585,50.0,2469
TRADITIONAL MODELLING CLAY,9311.47,4655.735,50.0,8014
TRADITIONAL KNITTING NANCY,9297.87,4648.935,50.0,5895
SET OF 4 KNICK KNACK TINS DOILY ,9270.5,4635.25,50.0,2294
BLUE HARMONICA IN BOX ,9222.63,4611.315,50.0,7434
FAWN BLUE HOT WATER BOTTLE,9218.550000000001,4609.275000000001,50.0,2925
RED RETROSPOT ROUND CAKE TINS,9188.25,4594.125,50.0,975
REGENCY TEA PLATE GREEN ,9184.9,4592.45,50.0,5966
PANTRY ROLLING PIN,9184.28,4592.14,50.0,2407
WOODEN SCHOOL COLOURING SET,9072.87,4536.435,50.0,5695
EDWARDIAN PARASOL RED,9055.87,4527.935,50.0,1630
REGENCY MILK JUG PINK ,9008.0,4504.0,50.0,3066
REVOLVER WOODEN RULER ,8950.289999999999,4475.1449999999995,50.0,4917
3 TIER CAKE TIN RED AND CREAM,8737.78,4368.89,50.0,652
STRAWBERRY LUNCH BOX WITH CUTLERY,8734.64,4367.32,50.0,3716
LADIES & GENTLEMEN METAL SIGN,8699.130000000001,4349.5650000000005,50.0,3899
SET OF 20 KIDS COOKIE CUTTERS,8697.27,4348.635,50.0,4149
PINK CREAM FELT CRAFT TRINKET BOX ,8648.49,4324.245,50.0,7131
GINGERBREAD MAN COOKIE CUTTER,8625.13,4312.565,50.0,7204
60 TEATIME FAIRY CAKE CASES,8618.369999999999,4309.1849999999995,50.0,17689
SET OF 6 SOLDIER SKITTLES,8597.5,4298.75,50.0,2297
AREA PATROLLED METAL SIGN,8552.220000000001,4276.110000000001,50.0,4290
VINTAGE DOILY JUMBO BAG RED ,8535.26,4267.63,50.0,4447
VINTAGE HEADS AND TAILS CARD GAME ,8531.41,4265.705,50.0,7143
JUMBO BAG PAISLEY PARK,8529.24,4264.62,50.0,4373
HAND WARMER RED RETROSPOT,8526.12,4263.06,50.0,4274
ENAMEL BREAD BIN CREAM,8519.0,4259.5,50.0,713
"RECORD FRAME 7"" SINGLE SIZE ",8450.82,4225.41,50.0,3812
FAMILY ALBUM WHITE PICTURE FRAME,8416.64,4208.32,50.0,1075
T-LIGHT GLASS FLUTED ANTIQUE,8378.89,4189.445,50.0,7336
SWEETHEART CAKESTAND 3 TIER,8376.6,4188.3,50.0,892
POTTERING IN THE SHED METAL SIGN,8372.7,4186.35,50.0,3926
"SET 3 RETROSPOT TEA,COFFEE,SUGAR",8354.87,4177.435,50.0,1841
BOX OF 6 MINI VINTAGE CRACKERS,8350.41,4175.205,50.0,3647
SET 2 PANTRY DESIGN TEA TOWELS,8323.17,4161.585,50.0,2697
FELTCRAFT BUTTERFLY HEARTS,8314.55,4157.275,50.0,6127
SET OF 3 NOTEBOOKS IN PARCEL,8283.75,4141.875,50.0,5207
MULTI COLOUR SILVER T-LIGHT HOLDER,8269.45,4134.725,50.0,10279
BOX OF 6 MINI 50'S CRACKERS,8216.79,4108.395,50.0,3539
LARGE WHITE HEART OF WICKER,8184.700000000001,4092.3500000000004,50.0,2908
HANGING JAM JAR T-LIGHT HOLDER,8164.12,4082.06,50.0,10528
3 HEARTS HANGING DECORATION RUSTIC,8161.21,4080.605,50.0,2895
SET 6 PAPER TABLE LANTERN HEARTS ,8129.43,4064.715,50.0,2265
VINTAGE RED KITCHEN CABINET,8125.0,4062.5,50.0,60
ICE CREAM PEN LIP GLOSS ,8077.31,4038.655,50.0,6607
FELTCRAFT PRINCESS CHARLOTTE DOLL,8071.51,4035.755,50.0,2223
DOORMAT MULTICOLOUR STRIPE,8053.22,4026.61,50.0,1419
SET OF 6 RIBBONS VINTAGE CHRISTMAS,8051.83,4025.915,50.0,2843
ALARM CLOCK BAKELIKE ORANGE,7995.63,3997.815,50.0,2182
CHILDRENS CUTLERY SPACEBOY ,7974.38,3987.19,50.0,1982
RED METAL BOX TOP SECRET,7962.03,3981.015,50.0,1003
RECIPE BOX RETROSPOT ,7952.900000000001,3976.4500000000003,50.0,2870
SET OF 72 RETROSPOT PAPER  DOILIES,7947.37,3973.685,50.0,5680
SET/10 RED POLKADOT PARTY CANDLES,7799.18,3899.59,50.0,6502
TRAVEL SEWING KIT,7787.36,3893.68,50.0,4864
GRAND CHOCOLATECANDLE,7785.05,3892.525,50.0,5801
PICNIC BASKET WICKER SMALL,7746.700000000001,3873.3500000000004,50.0,1427
SET OF 3 HEART COOKIE CUTTERS,7741.84,3870.92,50.0,6019
FELTCRAFT CHRISTMAS FAIRY,7722.68,3861.34,50.0,1896
JUMBO BAG TOYS ,7689.28,3844.64,50.0,4198
ZINC FOLKART SLEIGH BELLS,7665.110000000001,3832.5550000000003,50.0,4647
HAND WARMER RED LOVE HEART,7660.200000000001,3830.1000000000004,50.0,3762
FAMILY PHOTO FRAME CORNICE,7646.84,3823.42,50.0,837
BLUE DINER WALL CLOCK,7528.93,3764.465,50.0,907
SET 6 SCHOOL MILK BOTTLES IN CRATE,7510.29,3755.145,50.0,2067
PAINTED METAL PEARS ASSORTED,7491.4,3745.7,50.0,4476
60 CAKE CASES VINTAGE CHRISTMAS,7417.849999999999,3708.9249999999997,50.0,14735
SMALL GLASS HEART TRINKET POT,7412.56,3706.28,50.0,3670
PLASTERS IN TIN VINTAGE PAISLEY ,7346.69,3673.345,50.0,4573
OPEN CLOSED METAL SIGN,7311.36,3655.68,50.0,1577
WOODLAND CHARLOTTE BAG,7277.24,3638.62,50.0,9237
PACK OF 12 LONDON TISSUES ,7266.71,3633.355,50.0,25345
WOODEN BOX OF DOMINOES,7215.95,3607.975,50.0,5778
 SET 2 TEA TOWELS I LOVE LONDON ,7208.95,3604.475,50.0,2627
CHOCOLATE THIS WAY METAL SIGN,7208.52,3604.26,50.0,3635
SILVER HANGING T-LIGHT HOLDER,7193.25,3596.625,50.0,4665
SET OF 4 KNICK KNACK TINS LONDON ,7170.599999999999,3585.2999999999997,50.0,1788
FELTCRAFT PRINCESS LOLA DOLL,7166.94,3583.47,50.0,1964
PACK OF 6 BIRDY GIFT TAGS,7149.7,3574.85,50.0,6062
CHARLOTTE BAG SUKI DESIGN,7138.65,3569.325,50.0,8975
SET OF 4 KNICK KNACK TINS DOILEY ,7136.849999999999,3568.4249999999997,50.0,1803
CHRISTMAS CRAFT LITTLE FRIENDS,7128.1,3564.05,50.0,3468
CREAM CUPID HEARTS COAT HANGER,7125.38,3562.69,50.0,1918
ZINC METAL HEART DECORATION,7108.68,3554.34,50.0,5757
SWEETHEART RECIPE BOOK STAND,7084.650000000001,3542.3250000000003,50.0,1099
RED SPOTTY BISCUIT TIN,7071.2,3535.6,50.0,2058
 SPACEBOY BABY GIFT SET,7065.499999999999,3532.7499999999995,50.0,450
FUNKY DIVA PEN,7010.94,3505.47,50.0,8328
36 DOILIES VINTAGE CHRISTMAS,7006.25,3503.125,50.0,5153
RAIN PONCHO RETROSPOT,6964.63,3482.315,50.0,8755
JINGLE BELL HEART ANTIQUE SILVER,6962.04,3481.02,50.0,3547
TRIPLE PHOTO FRAME CORNICE ,6932.83,3466.415,50.0,761
GIANT 50'S CHRISTMAS CRACKER,6926.11,3463.055,50.0,2635
CLEAR DRAWER KNOB ACRYLIC EDWARDIAN,6923.17,3461.585,50.0,5753
SWEETHEART CERAMIC TRINKET BOX,6875.860000000001,3437.9300000000003,50.0,5757
PACK OF 72 SKULL CAKE CASES,6859.3099999999995,3429.6549999999997,50.0,14309
NATURAL SLATE CHALKBOARD LARGE ,6833.2,3416.6,50.0,1452
SMALL WHITE HEART OF WICKER,6832.83,3416.415,50.0,4283
HANGING HEART ZINC T-LIGHT HOLDER,6830.59,3415.295,50.0,8470
GIRAFFE WOODEN RULER,6820.74,3410.37,50.0,3710
SET/2 RED RETROSPOT TEA TOWELS ,6820.01,3410.005,50.0,2319
VINTAGE CREAM DOG FOOD CONTAINER,6779.35,3389.675,50.0,826
WHITE WOOD GARDEN PLANT LADDER,6778.8099999999995,3389.4049999999997,50.0,724
YOU'RE CONFUSING ME METAL SIGN ,6762.57,3381.285,50.0,4281
RETROSPOT PARTY BAG + STICKER SET,6749.23,3374.615,50.0,4391
VINTAGE DOILY TRAVEL SEWING KIT,6747.9,3373.95,50.0,3522
SET 6 PAPER TABLE LANTERN STARS ,6739.63,3369.815,50.0,1860
RED FLORAL FELTCRAFT SHOULDER BAG,6734.31,3367.155,50.0,1876
SET OF 3 BUTTERFLY COOKIE CUTTERS,6718.9,3359.45,50.0,5293
LUNCH BOX WITH CUTLERY RETROSPOT ,6717.79,3358.895,50.0,2853
DOORMAT 3 SMILEY CATS,6715.25,3357.625,50.0,1107
HOME SWEET HOME MUG,6708.11,3354.055,50.0,5347
CARRIAGE,6686.0,3343.0,50.0,134
CHILDS BREAKFAST SET SPACEBOY ,6681.849999999999,3340.9249999999997,50.0,731
SET 40 HEART SHAPE PETIT FOUR CASES,6677.0,3338.5,50.0,4260
HEART FILIGREE DOVE  SMALL,6671.07,3335.535,50.0,5439
DOORMAT UNION JACK GUNS AND ROSES,6635.61,3317.805,50.0,1159
ROUND CAKE TIN VINTAGE RED,6600.7300000000005,3300.3650000000002,50.0,891
MINT KITCHEN SCALES,6599.79,3299.895,50.0,792
CHILDRENS CUTLERY POLKADOT GREEN ,6599.06,3299.53,50.0,1688
ROSE COTTAGE KEEPSAKE BOX ,6574.95,3287.475,50.0,729
ALARM CLOCK BAKELIKE CHOCOLATE,6574.26,3287.13,50.0,1776
CHILDRENS APRON SPACEBOY DESIGN,6572.49,3286.245,50.0,3543
DOLLY GIRL BABY GIFT SET,6567.95,3283.975,50.0,421
CHILDRENS CUTLERY DOLLY GIRL ,6554.6,3277.3,50.0,1628
SET OF 20 VINTAGE CHRISTMAS NAPKINS,6530.26,3265.13,50.0,8122
PLASTERS IN TIN SKULLS,6505.8,3252.9,50.0,4036
SET OF 12 FAIRY CAKE BAKING CASES,6469.45,3234.725,50.0,8243
VICTORIAN SEWING BOX SMALL ,6432.110000000001,3216.0550000000003,50.0,1128
LARGE ZINC HEART WALL ORGANISER,6414.48,3207.24,50.0,1064
BEWARE OF THE CAT METAL SIGN ,6405.31,3202.655,50.0,4027
PICTURE FRAME WOOD TRIPLE PORTRAIT,6378.150000000001,3189.0750000000003,50.0,1023
BLACK/BLUE POLKADOT UMBRELLA,6367.9400000000005,3183.9700000000003,50.0,1133
SET/10 PINK POLKADOT PARTY CANDLES,6353.58,3176.79,50.0,5257
PIGGY BANK RETROSPOT ,6308.57,3154.285,50.0,2619
MEMO BOARD COTTAGE DESIGN,6306.1900000000005,3153.0950000000003,50.0,1365
BLUE STRIPE CERAMIC DRAWER KNOB,6284.25,3142.125,50.0,4969
72 SWEETHEART FAIRY CAKE CASES,6274.9,3137.45,50.0,13070
METAL 4 HOOK HANGER FRENCH CHATEAU,6273.29,3136.645,50.0,2151
RETROSPOT LARGE MILK JUG,6267.150000000001,3133.5750000000003,50.0,1317
LANDMARK FRAME CAMDEN TOWN ,6257.35,3128.675,50.0,558
TOY TIDY PINK POLKADOT,6229.58,3114.79,50.0,3169
RED STRIPE CERAMIC DRAWER KNOB,6224.03,3112.015,50.0,5035
LOVE SEAT ANTIQUE WHITE METAL,6210.0,3105.0,50.0,58
3 DRAWER ANTIQUE WHITE WOOD CABINET,6195.73,3097.865,50.0,715
BOX OF 6 CHRISTMAS CAKE DECORATIONS,6155.04,3077.52,50.0,1712
SAVE THE PLANET MUG,6151.78,3075.89,50.0,5265
HAND WARMER BABUSHKA DESIGN,6149.33,3074.665,50.0,4633
VINTAGE DONKEY TAIL GAME ,6146.89,3073.445,50.0,1750
MINI LIGHTS WOODLAND MUSHROOMS,6126.09,3063.045,50.0,1719
COFFEE MUG APPLES DESIGN,6124.150000000001,3062.0750000000003,50.0,2770
CIRCUS PARADE LUNCH BOX ,6122.629999999999,3061.3149999999996,50.0,3375
LARGE CIRCULAR MIRROR MOBILE,6107.049999999999,3053.5249999999996,50.0,6821
WALL ART CLASSIC PUDDINGS ,6093.49,3046.745,50.0,821
AGED GLASS SILVER T-LIGHT HOLDER,6083.2,3041.6,50.0,10088
JINGLE BELL HEART DECORATION,6069.15,3034.575,50.0,3687
CHILDS BREAKFAST SET DOLLY GIRL ,6063.0,3031.5,50.0,657
TEA TIME TEA TOWELS ,6045.0,3022.5,50.0,2600
JUMBO BAG DOLLY GIRL DESIGN,6008.41,3004.205,50.0,3097
SET OF 60 PANTRY DESIGN CAKE CASES ,5982.09,2991.045,50.0,11675
BROCADE RING PURSE ,5980.05,2990.025,50.0,22963
DELUXE SEWING KIT ,5974.62,2987.31,50.0,1058
CHRISTMAS LIGHTS 10 VINTAGE BAUBLES,5968.9800000000005,2984.4900000000002,50.0,1280
4 TRADITIONAL SPINNING TOPS,5960.08,2980.04,50.0,4491
DOORSTOP RETROSPOT HEART,5938.21,2969.105,50.0,1516
PACK OF 60 DINOSAUR CAKE CASES,5934.68,2967.34,50.0,12134
PLACE SETTING WHITE HEART,5922.2699999999995,2961.1349999999998,50.0,14877
SET 3 WICKER OVAL BASKETS W LIDS,5922.12,2961.06,50.0,462
WOODEN HAPPY BIRTHDAY GARLAND,5910.150000000001,2955.0750000000003,50.0,2093
RED RETROSPOT PEG BAG,5880.05,2940.025,50.0,2460
SET 2 TEA TOWELS I LOVE LONDON ,5859.25,2929.625,50.0,1953
SET OF 2 TEA TOWELS APPLE AND PEARS,5855.24,2927.62,50.0,1980
CHARLOTTE BAG PINK POLKADOT,5840.64,2920.32,50.0,7306
RED RETROSPOT SMALL MILK JUG,5830.2,2915.1,50.0,2460
PINK FAIRY CAKE CHILDRENS APRON,5823.36,2911.68,50.0,3144
CHICK GREY HOT WATER BOTTLE,5810.37,2905.185,50.0,1555
PANTRY WASHING UP BRUSH,5795.86,2897.93,50.0,3920
BISCUIT TIN 50'S CHRISTMAS,5795.2,2897.6,50.0,2060
REGENCY TEA PLATE PINK,5793.28,2896.64,50.0,3688
WOODEN OWLS LIGHT GARLAND ,5781.35,2890.675,50.0,1535
CANDLEHOLDER PINK HANGING HEART,5771.780000000001,2885.8900000000003,50.0,2046
ENGLISH ROSE HOT WATER BOTTLE,5767.91,2883.955,50.0,1423
BINGO SET,5725.71,2862.855,50.0,1553
LANTERN CREAM GAZEBO ,5721.42,2860.71,50.0,1214
BOTANICAL GARDENS WALL CLOCK ,5719.0,2859.5,50.0,259
WHITE METAL LANTERN,5713.03,2856.515,50.0,1591
PANTRY CHOPPING BOARD,5695.860000000001,2847.9300000000003,50.0,1138
SOMBRERO ,5691.5,2845.75,50.0,4402
SET OF 6 TEA TIME BAKING CASES,5687.150000000001,2843.5750000000003,50.0,4879
UNION STRIPE WITH FRINGE  HAMMOCK,5682.09,2841.045,50.0,759
SINGLE HEART ZINC T-LIGHT HOLDER,5664.78,2832.39,50.0,5700
SET OF 2 WOODEN MARKET CRATES,5652.9,2826.45,50.0,462
DOORMAT TOPIARY,5644.46,2822.23,50.0,880
CHARLOTTE BAG APPLES DESIGN,5632.15,2816.075,50.0,7039
WHITE SPOT RED CERAMIC DRAWER KNOB,5618.04,2809.02,50.0,4564
QUEENS GUARD COFFEE MUG,5603.570000000001,2801.7850000000003,50.0,2365
RETROSPOT CHILDRENS APRON,5587.87,2793.935,50.0,3039
SET OF 72 PINK HEART PAPER DOILIES,5566.679999999999,2783.3399999999997,50.0,3954
VINTAGE CHRISTMAS STOCKING ,5564.25,2782.125,50.0,2199
RED 3 PIECE RETROSPOT CUTLERY SET,5555.13,2777.565,50.0,1543
VINTAGE CHRISTMAS GIFT SACK,5527.150000000001,2763.5750000000003,50.0,1365
VINTAGE SNAKES & LADDERS,5523.53,2761.765,50.0,1575
STRAWBERRY CHARLOTTE BAG,5520.95,2760.475,50.0,6847
SET/6 RED SPOTTY PAPER PLATES,5496.53,2748.265,50.0,7351
3 STRIPEY MICE FELTCRAFT,5478.05,2739.025,50.0,2923
POLKADOT PEN,5475.25,2737.625,50.0,6625
PINK BABY BUNTING,5448.11,2724.055,50.0,1965
FELTCRAFT PRINCESS OLIVIA DOLL,5446.1,2723.05,50.0,1514
RUSTIC  SEVENTEEN DRAWER SIDEBOARD,5415.0,2707.5,50.0,35
PARISIENNE JEWELLERY DRAWER ,5399.02,2699.51,50.0,765
SMALL ZINC HEART WALL ORGANISER,5378.8,2689.4,50.0,1538
PHOTO FRAME 3 CLASSIC HANGING,5377.45,2688.725,50.0,554
CLASSIC GLASS COOKIE JAR,5358.5,2679.25,50.0,1334
WALL ART BIG LOVE ,5340.21,2670.105,50.0,963
WOODEN ADVENT CALENDAR CREAM,5340.0,2670.0,50.0,370
LUNCH BAG PAISLEY PARK  ,5267.75,2633.875,50.0,3315
DOG BOWL CHASING BALL DESIGN,5227.929999999999,2613.9649999999997,50.0,1341
BUNDLE OF 3 ALPHABET EXERCISE BOOKS,5225.22,2612.61,50.0,3286
10 COLOUR SPACEBOY PEN,5209.17,2604.585,50.0,6267
LARGE IVORY HEART WALL ORGANISER,5142.91,2571.455,50.0,759
SET OF 5 LUCKY CAT MAGNETS ,5121.4800000000005,2560.7400000000002,50.0,2538
RED RETROSPOT SHOPPER BAG,5115.31,2557.655,50.0,4264
CERAMIC CAKE STAND + HANGING CAKES,5084.78,2542.39,50.0,562
CALENDAR PAPER CUT DESIGN,5072.64,2536.32,50.0,1768
SMALL IVORY HEART WALL ORGANISER,5069.58,2534.79,50.0,1022
SET OF 6 NATIVITY MAGNETS ,5058.59,2529.295,50.0,2543
WOODEN ADVENT CALENDAR RED,5047.6,2523.8,50.0,536
RED RETROSPOT BOWL,5046.9800000000005,2523.4900000000002,50.0,4363
RED SPOT CERAMIC DRAWER KNOB,5042.4,2521.2,50.0,4080
TREASURE ISLAND BOOK BOX,5036.55,2518.275,50.0,2431
3 PIECE SPACEBOY COOKIE CUTTER SET,5034.64,2517.32,50.0,2514
BOX OF VINTAGE JIGSAW BLOCKS ,5031.570000000001,2515.7850000000003,50.0,920
BLUE SPOT CERAMIC DRAWER KNOB,5028.5199999999995,2514.2599999999998,50.0,4004
CHRISTMAS CRAFT TREE TOP ANGEL,5025.58,2512.79,50.0,2448
LIGHT GARLAND BUTTERFILES PINK,5018.84,2509.42,50.0,1340
VICTORIAN SEWING BOX LARGE,5014.23,2507.115,50.0,425
